FName,LName,Q7,Q34,wit1p,mot1p,mot2p,si1p,si2p,si3p,si4p,si5p,mcon1p,mcon2p,mcon3p,mcon4p,mcon5p,wit2p,wit3p,wit4p,wit5p,wit6p,mot3p,mot4p,lbe1p,lbe2p,lbe3p,pdm1p,pdm2p,pdm3p,coach1p,coach2p,coach3p,inf1p,inf2p,inf3p,scti1p,scti2p,scti3p,sg1p,sg6p,sg2p,ej3p,ej2p,ej5p,ed3p,ed6p,ed8p,sd3p,sd7p,sd1p,hg1p,hg3p,hg4p,MBL1p,MBL2p,MBL3p,MBL4p,MBL5p,MBL6p,MBL7p,MBL8p,MBL9p,VSL1p,VSL2p,VSL3p,VSL4p,VSL5p,VSL6p,VSL7p,VSL8p,ie1p,ie2p,ie3p,tmx1p,tmx2p,tmx3p,tmx4p,tmx5p,coop1p,coop2p,coop3p,cre1p,cre2p,cre3p,cre4p,cre5p,cre6p,net1p,ii1p,ii2p,ii3p,sa1p,net2p,sa2p,asin1p,net3p,net4p,net5p,ii4p,asin2p,asin3p,net6p,sa3p,sa4p,sa5p,Q1,Q2,Q3
Fayy,Ang,40,4,2,7,6,3,3,7,1,4,5,7,6,7,1,7,6,7,1,7,7,6,6,7,7,6,6,7,1,3,7,2,6,7,3,1,2,6,7,2,6,7,7,6,2,4,5,7,7,6,7,2,2,5,3,2,2,2,2,2,2,2,2,2,2,2,2,2,2,4,6,7,7,5,6,7,7,6,7,7,6,6,7,4,4,6,,,,,,,,,,,,,,,,,,,Brings teams together and engages them to work together,"Be stronger on her opinions and until convinced otherwise, do maintain her stick on the ground","You take into every project and activity to support the group, perhaps you can help us prioritize a bit more when some projects seemed to be less relevant to others, and even bring up those that have not even been stared and are important to do."
Fayy,Ang,7 months,2,4,7,7,4,5,6,2,5,4,,4,,5,7,7,7,1,7,6,3,7,4,3,6,6,7,3,4,7,7,6,5,3,6,7,4,6,6,4,5,7,7,7,7,7,7,7,5,5,4,5,5,4,5,4,4,5,4,4,2,2,2,3,4,4,4,4,6,5,4,4,3,5,,6,6,5,,6,4,6,5,6,6,7,5,6,7,4,7,5,4,7,7,7,7,4,5,4,4,4,4,"Fayy attempts to take an initiative to lead the projects. When she knows how to handle the tasks, she takes prompt action on that. ","Fayy may try to speak complex words occasionally which might make the listener to understand the context harder. In my opinion, it is better to have simpler communication when certain topics are discussed. It will help the listener to be on the same page when both sides understand each other easily.  ",I contemplate Fayy should make more focus on work-life balance. Most of the time I notice she works from morning till late evening in her local time. It gives additional pressure on her co-worker(s) to meet the overall expectation of team's performance. 
Fayy,Ang,18,3,1,6,7,7,6,6,2,2,6,6,7,2,3,7,6,7,1,2,7,2,7,6,6,6,6,6,5,,6,6,,6,6,,,5,5,6,6,6,6,6,5,6,4,5,7,7,6,5,5,4,4,4,4,3,4,5,5,5,4,4,4,4,4,3,2,6,6,7,6,3,6,7,6,6,7,4,7,7,7,7,7,7,6,7,7,7,6,6,6,6,6,5,5,6,6,7,6,5,5,5,Fayy is inclusive.  Has a great work ethics and she is really good at processing information and applying it to the benefit of the projects.,"When communicating, it is important to always pause and allow others to contribute.",
Fayy,Ang,24 months,2,1,6,6,7,6,7,2,2,6,6,6,4,2,7,7,7,2,2,6,1,,6,6,6,6,6,,,6,,6,7,6,7,7,6,6,6,6,7,7,6,7,7,7,6,6,6,7,6,3,4,2,3,3,2,2,3,4,2,3,3,4,3,3,2,2,6,6,6,7,7,6,7,7,7,7,6,6,7,7,5,6,5,5,6,6,6,5,6,5,6,6,5,5,5,6,6,6,5,5,5,,,
Fayy,Ang,36,3,2,6,6,6,5,6,4,2,5,5,6,3,3,6,5,6,3,5,5,2,6,6,6,6,6,6,5,6,7,6,6,6,5,5,6,5,6,5,5,6,6,6,5,5,5,5,5,6,5,5,4,4,4,4,5,4,4,4,5,4,5,5,4,4,4,4,4,7,7,7,6,6,6,6,6,7,6,6,6,6,7,6,6,6,5,6,6,6,6,5,6,6,5,5,5,6,6,6,5,6,6,6,"Fayy does exceptionally well in being organized when working with others. she consistently demonstrate a high level of attention to detail and ensure that tasks and projects are well-planned and executed. This level of organization not only enhances her own productivity but also positively impacts the team's efficiency and effectiveness.

Additionally, Fayy is friendly and approachable, creating a comfortable and inclusive atmosphere for collaboration. her positive attitude and willingness to listen and support others contribute to a harmonious work environment.
Overall, Fayy's strong organizational skills, friendly demeanor, and presentable approach make her a valuable asset when working with others.","One area that Fayy can work on when it comes to working with others is building stronger connections . While Fayy is efficient and task-oriented, it would be beneficial for her to foster stronger relationships within the organization.",I am truly enjoying working with Fayy.
Fayy,Ang,12 months,3,1,6,7,7,7,7,2,2,5,5,6,2,2,7,6,7,1,2,7,1,7,7,7,7,7,7,5,6,6,7,7,7,7,7,7,6,7,4,5,6,6,6,6,7,5,5,6,5,6,6,4,4,3,3,3,2,3,5,5,3,2,3,4,2,2,2,2,7,7,7,7,7,7,7,5,7,7,,7,7,7,7,7,7,5,7,7,7,6,7,6,7,7,7,6,6,6,7,5,5,5,5,Listening and analysis of a situation and objective. Fayy is a great listener and restates the issue/problem statement to ensure she is understands the area of focus. ,,
Fayy,Ang,24,2,5,4,6,6,5,7,5,6,5,6,6,4,4,7,5,6,6,6,7,4,6,6,6,6,6,6,6,6,6,6,6,6,4,4,5,4,6,5,5,5,6,6,6,6,5,5,6,4,5,4,4,4,5,4,2,2,3,2,3,4,4,2,4,4,4,3,3,7,6,7,6,6,6,6,5,6,7,6,6,7,7,7,6,6,5,6,6,7,6,6,6,6,7,6,6,6,6,6,6,6,6,5,Project management. Fayy is great in this and is able to rally a big team towards one goal. ,Probably take a pause when communicating. this will help Fayy articulate her thoughts better.,N/A
Fayy,Ang,60,3,2,4,6,4,3,6,2,2,6,6,6,3,4,6,6,6,2,2,6,2,4,4,6,,3,6,,,6,,,6,6,6,,4,6,4,4,4,6,4,4,6,6,6,4,4,6,4,2,3,3,3,2,2,2,2,2,2,2,2,2,2,2,2,2,5,5,5,5,5,5,5,5,5,5,5,6,,,6,6,6,4,6,6,6,5,4,4,6,4,6,4,4,6,6,6,4,4,4,"Fayy is able to lead team discussion well and more often then not, she facilitates the meeting appropriately and lessen the tension should there be any strong ""heated"" discussions occurring. ",Fayy could try to speak up more on her opinions.,
Fayy,Ang,9 months,3,3,6,6,6,5,5,4,3,4,4,5,4,5,5,6,6,4,7,7,4,6,4,5,6,6,6,,,5,,,6,6,6,6,6,5,4,2,5,6,6,5,5,5,5,5,4,4,4,,,2,,,,,,,,,,,,,,,7,7,7,5,4,5,6,5,6,7,6,5,6,5,6,5,6,5,5,5,5,5,4,3,4,5,4,5,5,4,5,5,,,,"Fayy is good at analyzing the complex set of data, using the correct tools and facilitating discussions by asking the correct questions to make people think and talk more. We are co-managing several projects with her. She puts her efforts on understanding the data and builds great slides to create the understanding among the audience. she can always facilitate the meetings with the senior managers in confidence.  ","Fayy is hard working person and also she wants everything to be done quickly. however in a team environment, speed is not necessary all the time. While she can try to complete the tasks quickly, she can take more responsibilities than she had to. I think it is better to give more space for the others which will allow people to contribute more.",
Fayy,Ang,4,3,2,6,6,5,5,6,4,2,5,4,6,2,2,6,6,7,7,2,7,2,6,6,6,6,6,6,4,5,6,5,5,6,6,6,6,6,6,5,6,7,6,6,6,6,6,6,6,6,4,6,5,5,5,5,5,3,4,5,4,4,4,4,4,4,4,4,4,7,7,6,7,5,6,7,6,7,7,7,6,6,6,6,7,6,6,6,5,6,6,6,6,7,6,6,6,6,6,6,6,6,6,6,Strong project manager that is aware of team goals and milestones; very proactive in ensuring we have a game plan.,"in some team settings, Fayy will be quiet.  Some of that may be her being deferential amongst other strong personalities but I know she has an opinion that the team would value.",
Fayy,Ang,36,3,2,5,6,4,5,7,1,4,5,4,7,4,2,7,,,1,3,6,4,6,6,7,7,7,7,7,3,6,,,6,7,7,7,6,7,7,7,6,7,7,7,7,7,7,7,4,5,5,4,4,4,4,4,4,4,5,5,4,4,3,4,2,2,3,3,7,7,7,5,1,,,,7,6,7,6,5,7,6,5,5,4,6,6,7,6,4,4,6,4,5,4,6,6,7,4,6,5,4,she works really fast and comes up with creative ways to gather a lot of information,Sometimes gets tangled on the details and the audience looking at them.,"She has great rapport with the team, knows well her areas"
Ezgi,Bal,60+,3,2,7,6,6,4,6,3,3,5,5,5,2,2,6,6,6,2,2,6,2,7,6,6,6,4,6,6,6,6,6,6,6,6,6,6,6,6,6,4,6,4,6,4,4,6,6,6,6,4,6,4,4,4,4,4,4,4,4,4,4,4,4,4,4,4,2,4,6,7,7,6,6,6,7,6,3,7,5,6,6,6,6,7,4,6,6,6,6,6,6,4,7,4,6,6,6,7,6,6,7,6,4,She is passionate about delivering the priorities and expectations of the team.  She will engage with stakeholders to align on the objectives.,"Ezgi is working in a remote environment (no other team members in country).  This can be challenging.  An opportunity may be to get involved in other GSMG/GWES networks eg. EBRG, Sustainability to grow her network and get additional sense of belonging and contribution.",A super motivated colleague that is great to work with.
Ezgi,Bal,9,3,5,5,4,6,4,5,5,3,4,5,6,4,4,7,6,5,4,4,6,2,5,5,5,4,5,6,5,5,6,6,6,6,6,6,6,6,5,6,6,6,5,6,5,5,6,5,6,7,5,5,3,4,3,4,4,3,4,4,3,3,3,4,3,2,3,3,4,6,6,6,6,6,5,6,6,6,7,6,5,4,5,5,5,4,6,5,5,5,6,5,5,5,5,5,5,5,5,5,5,5,5,5,She focuses to solve the problem quickly and efficiently.,She may check the background of the case to solve the problems easily.,-
Ezgi,Bal,30,2,3,5,6,6,6,6,3,4,5,7,6,5,3,4,5,5,5,3,4,3,4,5,5,6,5,5,4,5,6,5,,6,6,6,6,7,7,7,6,6,6,7,5,6,6,6,5,7,5,6,2,2,1,1,1,1,2,2,2,2,2,2,2,2,2,1,1,5,5,5,4,5,4,3,3,5,6,5,5,5,5,4,4,4,4,5,5,6,5,6,4,5,5,4,4,5,6,6,6,6,6,5,Ezgi is great at building a broad network of relationships within the company,Can be more proactive in creating solutions instead of reactive.,
Ezgi,Bal,48,5,1,7,6,6,7,6,3,1,6,6,6,3,3,6,6,6,1,3,6,2,7,7,6,6,6,6,6,6,6,6,6,6,6,6,7,6,6,6,6,6,6,6,6,6,6,6,6,6,6,6,4,5,4,4,5,4,4,5,4,4,4,4,5,4,4,4,4,6,6,7,6,6,6,7,7,6,6,5,6,6,7,7,6,6,7,6,7,6,6,6,6,6,6,6,7,7,6,6,6,7,6,6,She is authentic and genuine. She gets in contact with people and shows interest to hear them. She has a great energy level and exceptional aura that when she is in an environment she gets naturally all attentions. This really helps her to be heard and recognized in addition to her work quality and perfectionism. ,"As she is very fast thinking and communicating with all her emotions and know-how, some people around her might feel they stay behind her and cannot follow her. Her intelligence and intellectual knowledge is outstanding which she might need to take care if everyone gets her messages. ","It was always great to work with her and learning with her. At the same time it was quite fun to be around her which helped a lot team mood. She also challenges status quo constantly, like that she pushes limits always higher for better results. So in overall, i hope to work with her again in the future. "
Ezgi,Bal,36,1,1,6,7,6,7,7,4,1,7,6,7,2,4,7,7,7,2,2,6,2,6,7,7,7,7,7,6,6,6,6,7,7,7,7,7,7,6,7,4,7,7,7,7,7,7,7,7,5,5,7,5,5,5,5,5,5,5,5,5,5,5,5,5,5,4,5,5,7,7,7,7,6,6,7,6,7,7,7,5,5,6,6,7,7,7,7,7,7,7,7,7,7,7,7,7,7,7,7,7,7,7,7,Positive communication in all circumstances. , -,It is a pleasure working with Ezgi.
Ezgi,Bal,84,4,1,5,6,5,5,6,6,6,5,2,5,5,6,6,6,6,6,1,2,5,5,2,2,6,6,6,6,3,6,6,3,3,3,6,6,6,5,6,2,7,6,7,6,6,6,6,6,6,6,6,2,2,2,2,2,2,2,2,2,2,2,2,2,2,2,2,2,3,3,3,3,6,7,3,3,7,7,4,7,6,6,5,5,5,3,5,6,5,6,3,6,6,3,2,2,5,6,4,3,5,2,7,,,
Ezgi,Bal,18,3,2,5,6,7,7,6,3,2,3,4,6,2,2,7,6,6,2,1,6,2,6,6,6,3,6,6,3,2,6,6,6,6,5,4,5,2,4,2,4,7,4,6,6,6,5,5,6,6,5,7,2,2,2,2,1,2,3,3,2,1,1,1,1,1,1,1,1,7,6,7,4,3,2,5,5,5,7,4,3,3,4,2,5,2,6,6,6,6,5,6,4,3,6,6,6,6,,5,6,4,3,3,"Quick connection to discuss a problem to immedeatly disseminate the results of the discussion with the rest of the team.
In general, highly responsive (almost 24/7)",start group meeting with questions how the other team members are feeling? Give some time for small tald instead of jumping directly into content discussion.,take care of your work-life balance !
Ezgi,Bal,60,3,6,5,6,5,6,6,5,2,4,5,5,3,3,4,4,4,4,4,6,4,6,6,5,4,4,4,4,4,4,4,4,5,4,4,4,6,6,5,4,6,6,5,4,4,4,4,5,5,4,4,4,4,4,3,3,3,3,3,3,3,3,3,3,3,3,3,3,6,6,7,6,6,6,6,6,5,5,5,5,4,5,6,4,5,4,6,6,6,6,7,7,7,6,4,4,6,6,6,6,6,7,7,She is a very result-oriented person. Starts doing a job with an end in mind and never leaves any incomplete task.,She can delegate more task to the others in order to reduce the level of multitasking. ,
Ezgi,Bal,36,4,5,5,3,6,6,3,7,3,4,2,4,5,5,5,5,2,6,2,2,6,2,2,2,4,5,3,4,2,4,5,4,4,3,4,2,5,4,4,4,4,3,3,4,3,3,4,4,3,3,3,2,2,2,2,1,1,1,2,1,1,1,1,2,1,1,1,1,6,4,4,4,1,3,4,3,2,4,4,3,2,4,4,1,3,6,2,5,5,3,6,6,2,4,5,6,5,4,3,5,5,5,3,,,
Ezgi,Bal,36,1,1,7,6,6,6,5,6,2,6,6,6,2,3,7,6,6,2,2,7,2,6,6,6,6,6,6,6,6,6,7,7,7,6,6,7,4,4,4,4,4,4,4,4,4,4,4,4,4,4,4,,,,,,,,,,,,,,,,,,,,,,,,,,,,,,,,,,,,,,,,,,,,,,,,,,,,,,,
Ezgi,Bal,48,5,1,7,7,7,7,7,7,1,7,7,6,1,4,6,6,6,,1,7,1,6,7,7,7,7,7,7,7,7,7,7,7,7,7,7,6,6,6,4,6,7,7,7,7,7,7,7,7,7,7,5,5,5,5,5,5,5,5,5,5,5,5,5,5,5,5,5,7,7,7,7,7,7,7,7,7,7,7,7,7,7,7,7,7,6,6,6,6,6,6,6,6,6,6,4,4,4,6,6,6,4,6,,,
Ezgi,Bal,24,3,7,7,7,6,6,7,3,1,6,7,6,2,1,7,7,7,2,2,6,1,6,6,7,6,7,7,6,6,7,7,7,6,7,,7,6,7,6,6,7,7,7,6,7,7,6,7,6,7,7,4,5,5,4,4,4,5,4,2,2,2,3,2,2,2,1,1,7,6,7,5,4,6,6,5,7,7,7,6,7,7,7,7,7,6,6,6,6,6,6,6,6,6,6,6,6,4,4,6,4,4,4,Ezgi is able to connect to people to processes and the experts behind them e.g. Procurment processes,,
Ezgi,Bal,12months,3,2,6,4,6,5,7,2,4,5,6,7,2,2,6,6,6,2,2,6,2,6,6,6,7,7,7,,6,7,6,6,6,7,7,6,6,6,5,6,7,6,6,6,6,6,6,7,6,6,6,3,4,3,3,3,3,4,4,3,3,4,4,4,3,3,2,2,7,7,7,5,7,7,6,6,7,7,6,6,4,5,5,6,5,4,7,6,6,6,6,5,7,6,6,4,7,7,7,6,6,6,6,She is very good at listening and adjusting the plan according to the needs of the Team.,"She sometimes appears to be rushed or even stressed in conversations and often speaks about her busy workload. While I think she does a good job delegating, perhaps this could be worked on further. ",
Ezgi,Bal,48,1,3,3,4,3,5,6,1,2,1,3,5,4,1,6,4,3,3,2,2,2,2,2,2,2,4,7,2,2,6,1,1,1,6,6,6,6,4,7,7,5,6,7,5,5,6,6,6,4,2,1,1,2,2,2,3,3,2,1,3,2,2,2,3,3,3,1,1,7,5,5,2,2,3,2,2,5,7,7,2,3,2,2,1,2,5,6,6,6,6,5,2,7,5,5,5,5,7,6,2,2,2,4,Fantastic listener. I have been on many calls where Ezgi has been very attentively listening and follows-up with great questions. ,The greater the understanding of the business that Ezgi can have the move valuable that she can become when guiding and supporting the business. ,"To support her development, Ezgi should start to think about the impact that she can & wants to create within her team, department & organization.  With a vision, it will guide her in making decision on her growth. "
Ezgi,Bal,2 years,4,2,6,6,5,5,5,6,4,5,5,6,4,5,6,6,6,2,5,5,3,5,4,5,5,4,4,6,5,6,6,6,6,7,7,6,6,5,5,6,5,5,5,4,5,5,4,5,5,5,5,4,3,4,5,4,4,5,4,5,5,4,4,4,4,4,4,4,6,6,6,6,7,7,7,7,5,5,5,6,6,6,5,4,5,7,6,6,6,6,5,5,5,6,6,5,5,5,6,6,5,6,5,,,
Ezgi,Bal,24,6,1,7,7,7,7,7,2,1,6,7,7,1,2,7,7,7,1,1,7,1,6,7,7,7,7,7,,7,7,7,7,7,7,7,7,7,7,7,7,7,7,7,7,7,7,7,7,7,7,7,5,5,5,5,5,5,5,5,5,5,5,5,5,5,5,5,5,7,7,7,7,7,7,7,7,7,7,7,7,7,7,7,7,7,7,7,7,7,7,7,7,7,7,7,7,7,7,7,7,7,7,7,"I had the opportunity to witness her leadership style during Global RFP process.

There were some fundamental errors in volume forecast in the RFP document. In addition, business model was not clear and business units around the global team was not fully aligned.

Although not her responsibility, she explored the dynamics of the business, informed and aligned all business units and had the RFP document revised with real volume forecasts and scenarios.

As a result, MSD finalized the process with higher saving figures for MSD and with better quality KPIs.
",I believe that she needs to take higher responsibilities to proceed in her career.,"She is a hard-worker and an authentic leader. However, she puts so much on her shoulders and it may be good idea to balance her work and life balance."
Ezgi,Bal,4,3,2,6,5,5,6,5,7,5,5,,6,5,6,,7,5,2,5,6,3,7,6,6,5,,,,6,7,6,6,7,6,,,7,6,6,6,7,7,7,5,6,5,5,6,6,5,6,3,3,2,3,2,2,4,3,4,2,2,3,2,2,3,4,4,7,6,6,5,4,5,6,5,5,7,6,6,6,6,6,5,5,2,5,4,4,4,5,4,4,3,2,3,4,6,6,4,3,4,6,,,
Igor,Caio,12,4,1,7,3,6,6,7,2,2,6,7,7,2,3,7,6,7,1,4,6,1,7,7,7,6,7,7,4,5,7,7,7,7,7,7,7,7,7,6,4,5,7,6,7,7,7,7,7,7,7,7,5,5,5,5,5,5,5,5,5,5,5,5,5,5,5,5,5,7,6,6,7,4,6,7,7,7,7,7,7,7,7,7,7,7,4,6,5,6,7,4,4,4,6,4,4,4,5,7,5,5,4,4,"He is available as much as his schedule allows him.
I could always count on him each time I needed his help, guidance, opinion.","To be more transparent maybe.
I am not sure here, because I am not omnipotent, but I believe (maybe wrongly) that he is having too many initiative, and those initiatives could be wrong and not bring value, yet bring work (from my point of view).
So I would appreciate if before something is validated that I am aware of it.","I am very satisfied working with him since I started my role.
He is doing a lot of work, and his dedication is obvious to me.
I am impressed by the work done, but maybe it is too much. Sometimes, things require less for a more effective result.
But this is my personal opinion based on my personal experience."
Igor,Caio,18,3,1,6,6,4,4,7,2,1,4,4,6,2,2,7,6,7,1,2,7,2,7,7,7,7,6,6,4,4,7,4,6,6,7,6,7,6,6,6,6,6,7,7,4,6,4,4,6,4,6,4,5,5,4,5,4,4,4,5,5,4,4,5,3,3,3,3,3,7,6,6,5,7,6,7,6,7,7,5,4,6,6,5,6,5,4,6,6,6,6,6,4,6,5,4,4,6,6,6,4,6,4,6,"Igor is not afraid to work with the team to accomplish goals, especially when the workload is high. With the new Aravo system, Igor spends extra hours working on the team's work and escalating issues to the Aravo Administrators as needed. ","I don't work directly with Igor, I am in more of a support role and don't actually work on his team, so at this time I can't think of anything he can do to improve in this area.",I very much enjoy working with Igor! 
Igor,Caio,15,4,1,2,7,7,6,7,3,1,7,7,7,2,2,7,7,7,1,1,6,1,7,7,7,7,7,7,7,7,7,7,7,7,7,7,7,7,7,7,7,7,7,7,7,7,7,7,7,7,7,7,5,5,5,5,5,5,5,5,5,4,4,4,4,5,5,4,4,7,7,7,7,7,7,7,7,7,7,7,7,7,7,7,7,7,7,7,7,7,7,7,7,7,7,7,6,7,7,7,7,7,7,7,Igor has a strong mindset of focusing on what matters while winning as one team. He is able to listen different perspectives including the views of the team to effectively align on a common goal which helps to achieve the proposed objective.,"I suggest Igor to keep leading with his style of embracing diversity and inclusion, with open mind, service mindset and to keep working as one team.

",
Igor,Caio,14,4,1,7,7,6,6,7,6,2,7,7,7,1,2,7,7,7,1,1,7,1,6,7,7,7,7,7,7,7,7,7,7,7,7,7,7,1,7,7,7,7,7,7,7,7,7,7,7,7,7,7,5,5,5,5,5,5,5,5,5,5,5,5,5,5,5,4,4,7,7,7,7,7,7,7,7,7,7,7,7,7,7,7,7,7,7,7,7,7,7,7,7,7,7,7,7,7,7,7,7,7,7,7,"He is really opened to how his team is feeling about work and work load. Also, is always opened to new ideas.","I have no comments by the moment, he's been a great example to me.","He is great in his work creating and establishing meaningful and sincere networking with our stakeholders, is a role model for me as a true Leader"
Igor,Caio,3 months,4,1,7,7,7,4,7,4,1,7,7,7,2,2,7,5,7,1,1,6,1,7,7,7,7,6,7,7,7,7,7,7,7,7,7,7,7,7,7,7,7,7,7,7,7,7,7,7,7,7,7,5,5,5,5,5,5,5,5,5,5,5,5,5,5,5,5,5,7,7,7,7,7,7,6,7,7,7,7,7,7,7,7,7,7,4,7,7,7,7,7,7,7,7,7,4,6,6,7,7,7,7,4,"He leads with the example, Igor is a very understanding and kind person. He always tries to give his best for the welfare of the team. ",N/A,N/A
Igor,Caio,12,4,1,7,7,5,7,7,2,2,6,7,7,2,2,7,6,7,1,1,5,1,7,7,7,7,6,7,6,7,7,7,6,7,7,7,7,6,7,7,7,7,7,7,6,6,7,7,7,4,5,7,5,5,5,5,5,4,5,5,4,5,5,5,5,3,3,3,3,7,6,7,6,6,4,6,5,7,7,7,6,5,6,5,5,5,6,7,7,7,7,6,4,7,7,6,5,7,5,6,5,6,6,4,"Igor makes feel people comfortable speaking, expressing opinions, and listening them. So, I feel no restriction before talking about an idea, project or asking for help, as he is willing to listen all the time.","Come out with new ways of working, and help people to implement new ideas.","I think you're an exceptional leader who I know I can trust, and make me feel comfortable putting my best cause I know you would listen to it, and recognize it."
Igor,Caio,12,3,1,7,7,,6,6,4,2,6,7,6,2,2,7,7,7,2,2,6,1,7,6,7,7,6,6,6,7,7,7,7,7,7,7,7,6,6,6,6,6,6,6,6,6,6,6,6,4,4,6,5,5,5,5,5,5,5,5,5,4,4,5,5,5,5,4,4,7,7,7,4,5,6,6,5,6,7,,6,6,6,6,6,6,5,6,6,6,6,6,6,6,6,6,5,6,6,6,6,6,6,4,The takes the lead and analyzes everyone's opinions.,"Sometimes he could take an approach more aggresive, instead of a passive/slow way.",Igor is always willing to help with my requests and we always focus on the company's values. 
Igor,Caio,15 months,4,1,6,6,2,6,7,1,2,7,6,7,1,1,7,7,7,1,5,6,1,6,7,6,7,6,7,7,6,7,6,6,6,7,7,7,7,7,6,6,7,6,7,6,6,5,6,7,7,6,7,4,4,4,4,4,4,5,5,5,4,4,5,4,3,3,1,1,7,7,6,7,6,7,7,7,7,7,6,6,6,6,6,7,6,6,7,6,6,6,6,6,7,6,5,6,7,7,6,6,6,5,7,"Igor is very professional and helpful to others.  He is never selfish and always a team player.
He cares about his team on many levels.","Igor should try to delegate a bit more so he can spend more time networking and promoting our great team.  He is very concerned that we complete our tasks, and while important, it is also equally important for him to network for us and more importantly for himself, to grow his career.",He is an amazing person and one of the best managers I have ever had.  
Igor,Caio,3 months,4,1,6,7,6,4,7,4,1,7,7,7,4,3,7,7,7,2,2,6,1,7,7,7,7,6,7,7,7,7,7,7,7,7,7,7,7,7,7,7,7,7,7,7,7,6,7,6,7,7,7,5,5,5,5,4,4,5,5,5,4,5,4,5,5,5,4,5,7,7,7,7,6,7,7,7,7,7,7,6,7,7,6,6,6,6,7,7,7,7,6,6,6,6,6,5,6,7,6,7,6,7,5,"He is an amazing leader. he always know what we need to do in special cases, he respect everyone and know how to say the things. For example, I have a process that was giving me some issues because looks like I didn't assigned the process to me correctly, but the issue was from the system and Igor help me to identify the problem was not me but was the system in a good way and always supporting my job. ",I guess he is a good leader. he know how to work in team and always respect everyone. I guess there is nothing he can improve on when comes to work with others. ,"is an amazing person, is respectfull, always know how to guide us in the right direction and like to talk with us about the work but also about our lifes always taking into account our well being. Is the kind of leader which we can talk if we have a personal issue and he will understand so good and support us. "
Igor,Caio,15,3,1,6,5,3,4,5,1,3,6,7,7,5,1,7,6,7,2,2,7,1,6,6,6,7,7,7,6,6,6,7,6,6,7,7,7,6,6,6,6,6,6,6,6,6,6,7,7,5,7,5,5,5,5,5,5,5,4,4,4,4,4,5,5,4,4,4,4,5,5,5,5,5,5,5,5,7,7,7,7,7,7,6,6,6,6,6,6,6,6,6,5,5,6,6,6,6,7,7,6,6,7,7,Igor is an excellent listener and is able to hear all sides of a problem and considers them when making a decision.,I think Igor has the opportunity to be more vocal in group discussions. He has a calming presence but sometimes can be overrun by others.,Keep doing what you are doing!
Igor,Caio,12,2,1,7,6,4,4,7,1,1,6,6,7,2,2,7,4,7,6,4,6,1,7,7,7,7,4,7,6,6,7,7,6,6,7,7,7,6,6,6,4,7,6,6,6,6,6,6,6,6,6,6,3,3,3,3,4,4,3,4,4,3,4,4,4,4,4,4,4,6,6,6,,,,,,,,,,,,,,,,,,,,,,,,,,,,,,,,,,,
Igor,Caio,48,3,1,7,7,2,,7,2,2,7,,7,2,2,7,7,7,,2,7,2,2,7,7,7,2,7,7,7,7,7,7,7,7,7,7,2,6,6,6,6,6,6,6,6,6,6,4,6,6,6,,,,,,,,,,,,,,,,,,,,,,,,,,,,,,,,,,,,,,,,,,,,,,,,,,,,,,,
Igor,Caio,12+,2,1,6,6,6,6,6,1,1,,,,,,6,6,7,1,1,7,2,6,6,6,6,6,6,,6,7,,,6,7,6,6,7,7,7,7,7,7,7,7,7,4,4,6,6,6,4,4,4,4,4,4,4,4,4,4,4,4,4,4,4,4,4,4,6,6,6,6,6,,7,,5,7,1,6,6,6,6,6,6,4,6,6,6,6,6,4,6,4,4,4,6,6,6,4,6,4,6,,,
Igor,Caio,16,1,1,7,7,6,6,7,1,1,7,7,7,1,1,7,7,7,1,1,7,1,7,7,7,7,6,7,7,7,7,7,7,7,7,7,7,7,7,6,7,7,7,7,7,7,7,7,7,6,6,7,5,5,5,5,5,4,5,5,5,5,5,5,5,5,5,4,5,7,7,7,6,7,7,7,7,7,7,6,6,6,7,6,6,6,6,7,7,7,7,7,7,7,7,6,6,7,7,7,7,7,7,7,"Igor is exceptional at building trust with team members.  He is thoughtful in his interactions, genuinely cares about his colleagues and builds meaningful relationships.  He does this by sharing ideas with close team members, honoring commitments, communicating well and being genuine. Igor's direct reports feel valued and feel comfortable approaching Igor for advice and guidance.","Igor should continue to speak up and share his ideas in broader team meetings and with stakeholders outside of SD&PM.  This year Igor has started to provide valuable feedback on developing the process to perform parent-level due diligence.  It takes courage to speak up to leaders in other functional areas, but Igor has communicated his ideas well and is impacting change.  I encourage him to keep this collaboration and leadership up as we make improvements to the due diligence process enterprise-wide.",
Igor,Caio,12,2,2,6,,3,3,6,1,3,4,6,6,5,1,6,7,7,1,1,6,,6,6,6,6,6,7,,,7,,,,7,7,7,7,7,7,7,6,7,7,7,7,2,6,7,5,6,5,5,5,4,5,4,4,5,5,5,1,1,1,1,1,1,1,1,6,6,4,,,7,7,7,7,7,7,,,,,6,,5,7,5,7,6,4,6,7,4,3,3,7,7,7,5,6,2,4,Igor has such a calm and welcoming personality. I always feel like he is actively listening.,"Igor has an opportunity to make his thoughts and ideas more visible/heard. I’ve seen him express a valid viewpoint in private but then not express that viewpoint when someone else had a different, louder opinion. ",I want to hear more from him! I look forward to getting to know him better and getting his insights and vision.
Igor,Caio,60,2,2,6,6,6,6,6,3,2,6,6,6,5,3,6,6,6,3,3,6,2,6,7,6,6,6,6,6,6,6,6,6,6,6,6,6,6,6,6,6,6,6,6,6,6,6,6,6,6,6,6,4,4,4,4,4,4,4,4,4,4,4,4,4,4,4,3,4,6,7,7,4,5,3,6,6,7,7,7,6,6,6,6,6,6,4,6,6,5,6,6,6,6,6,5,4,6,6,6,6,6,6,5,"Igor is extremely dedicated, focused and organized team player.
It is remarkable his support in audits for LATAM region.",,
Ira,Chopra,24-36  ,2,1,6,7,6,6,6,2,1,5,6,6,2,1,6,6,6,5,2,6,2,6,7,7,6,5,6,5,4,6,4,4,5,6,5,6,6,6,5,4,6,6,7,6,4,4,5,4,6,4,4,2,2,2,2,2,2,2,2,2,2,2,1,1,2,2,1,1,6,6,6,4,2,5,4,4,6,7,2,5,5,5,5,5,5,5,7,7,7,7,5,6,7,4,4,4,6,6,6,6,7,7,7,"Good team player who listens, bringing new impactful and insightful perspective to meetings/discussions. He is very respectful and also communicates well",Continue to remind colleagues that he is a great resource that is available to them. ,
Ira,Chopra,24,2,1,4,6,2,5,6,2,2,6,7,7,2,2,6,6,6,2,1,6,1,4,6,6,7,6,6,6,5,6,5,5,5,7,6,7,6,6,6,6,6,3,6,6,5,5,6,4,6,6,6,1,2,3,2,1,2,2,3,2,1,1,1,2,1,1,1,1,5,3,4,4,5,6,7,6,6,6,7,5,6,4,6,4,6,4,6,6,6,6,6,6,6,5,5,4,6,5,6,6,6,6,5,,,
Ira,Chopra,24,2,1,6,7,7,6,7,1,2,6,6,7,2,1,6,7,7,2,1,6,2,6,6,7,7,6,7,6,,,6,6,4,6,7,7,6,7,6,4,6,7,6,7,6,6,7,4,6,7,7,2,5,2,4,2,2,4,5,2,2,,2,3,1,1,2,2,7,7,7,5,5,7,7,5,7,7,6,6,5,6,6,7,6,4,7,7,7,6,4,4,7,4,4,4,7,7,7,4,6,6,6,Ira is very gifted in making people comfortable and listened to.,,I would encourage Ira to continue to grow his network internally.
Ira,Chopra,24+,2,5,6,6,7,6,6,6,2,6,6,5,2,6,6,5,6,2,2,6,2,7,6,6,5,5,5,3,5,6,6,3,5,6,5,6,6,6,6,4,5,6,5,5,5,4,5,3,4,5,5,4,2,2,2,2,2,3,4,2,1,1,2,2,1,1,1,1,6,6,6,5,6,7,6,6,4,6,6,6,5,7,7,7,6,2,7,7,7,7,7,6,7,6,5,3,5,7,7,7,7,5,5,Ira has exceptional communication and personation skills - especially when peenting to peers or the business,Ira is extremely driven; if he has a project or task to complete then he will deliver.  Something this drive makes him blinkered. Sometimes he will benefit from pausing and taking onboard other perspectives.,
