Polly,Lin,36 months or so,3,1,,6,5,5,6,2,2,5,6,6,2,2,5,6,6,2,2,6,2,6,6,6,6,,6,,,6,,7,7,6,7,,5,6,6,6,7,6,6,6,6,6,6,6,6,6,6,2,2,3,3,2,2,3,4,3,2,2,3,2,2,3,3,2,5,6,7,5,,,5,5,5,7,7,6,6,6,6,6,5,6,7,7,7,7,7,6,6,6,6,5,6,6,6,6,6,6,6,Polly is very responsive and always shows the can-do spirit.  Working with Polly is a good experience as she's very hands on and always driving for better results for the teamN. ,No,
Polly,Lin,4,1,1,6,7,7,6,7,1,1,7,6,7,2,1,7,6,6,1,1,7,1,6,7,7,7,6,7,6,6,6,6,7,7,7,6,7,7,7,6,6,6,6,7,7,7,6,6,6,7,6,6,5,4,4,4,5,5,4,4,5,5,4,4,5,5,4,3,4,7,7,6,6,6,7,7,7,7,7,4,7,7,7,7,7,7,7,7,7,7,7,7,6,7,7,6,7,7,7,6,7,7,7,6,,,
Polly,Lin,18 months,6,1,7,7,5,6,7,1,1,7,7,7,1,1,7,7,7,1,1,7,1,7,7,7,6,7,7,7,7,7,7,7,7,7,7,7,7,7,7,7,7,7,7,7,7,7,7,7,7,7,7,5,5,5,5,5,5,5,5,5,5,5,5,5,5,5,3,3,7,7,7,7,7,,,7,7,7,6,7,7,7,7,7,7,7,7,7,7,7,7,7,7,7,6,7,7,7,7,7,7,7,6,Polly is a transparent communicator and is comprehensive in her ideas.,None.,
Polly,Lin, 18 Months,1,1,7,7,6,6,7,4,1,6,6,6,2,4,7,6,6,2,2,7,1,7,6,6,6,7,6,,6,6,7,7,7,5,6,6,6,6,6,7,7,7,7,6,6,6,7,7,7,7,7,5,5,5,5,5,4,5,4,4,3,3,4,4,4,4,4,3,7,,7,7,7,,7,7,7,7,7,7,7,7,7,7,7,5,7,7,7,7,7,6,7,7,6,5,6,7,7,6,6,7,6,Good at putting herself other's shoes and willing to support using best her knowledge. Always find the effective and innovative ways to get the job done. Well balance to prep the work and thinking about communicating/educating audiences. ,It will be good that she learn more how to manage conflicts and how effectively convince others when their interest is opposit or totally different. ,I think she is technically ready. Two cents advice from me to focus on how to articulate/visualize her vision and objective to senior leaders. 
Polly,Lin,5,3,2,6,6,6,6,6,2,2,6,6,6,,2,6,5,6,2,3,6,2,6,6,6,6,6,6,6,,,,6,,,,,6,6,6,6,6,6,6,6,6,5,6,6,6,6,6,3,3,3,3,3,3,3,3,3,3,3,3,3,3,3,3,3,6,6,6,6,6,6,6,6,6,6,6,6,6,6,6,6,6,6,6,6,6,6,6,6,6,6,6,6,6,6,6,6,6,6,6,She is listen carefully the needs of others and be able to find the common goal to achieve the target. ,Let other team members to be accountable for their work.,Keep shining and share her experiences with others. 
Polly,Lin,36 months,3,1,5,6,2,4,7,4,2,6,5,6,3,2,6,6,7,2,3,6,2,6,6,6,6,7,7,,,7,7,6,6,6,6,,6,6,4,4,4,6,6,6,6,4,6,4,4,4,4,4,3,5,4,5,4,4,4,4,3,3,4,4,4,4,4,4,7,6,6,5,4,6,6,6,7,7,6,6,6,6,7,7,6,7,7,7,7,6,7,6,7,7,7,7,7,7,7,7,7,7,7,,,
Polly,Lin,132,1,2,7,7,5,4,6,2,2,7,6,5,6,6,6,7,6,5,6,6,2,5,6,5,6,6,6,,6,6,,,,,6,6,6,6,6,4,5,7,6,6,6,6,6,6,7,6,6,4,2,4,4,5,4,4,4,4,4,4,4,4,4,4,4,4,4,6,5,7,6,6,6,6,6,6,6,7,7,7,7,6,6,2,6,6,6,5,6,6,6,5,3,2,6,3,3,6,4,5,6,Polly is open minded to take  new challenges and innovation to make things getting better.,Maybe Polly can stand on her point and show her belief to others. Don't be afraid to have a conflict with others.,n/a
Polly,Lin,4-5 years,3,1,6,7,6,6,7,3,1,7,7,6,3,3,7,7,7,1,3,6,1,7,7,7,7,6,7,6,6,7,6,7,7,7,7,7,6,7,7,6,7,6,7,7,7,6,7,6,7,6,7,4,4,4,4,4,4,4,5,4,5,4,4,5,5,5,4,4,7,6,7,6,6,7,6,6,6,6,7,7,6,7,7,7,6,6,6,6,7,7,6,5,7,6,6,5,4,7,7,5,6,5,5,Win as one team spirit. She can effectively contributes or leads to the success of the team/ project as a whole.,"She is too humble in her capability. Given the proven track record of her deliverables and achievements, she may express more and take on more impactful project/ assignment.",Keep on the great work in her core and continue the extraordinary leadership in the cross-functional team engagement!
Polly,Lin,4,3,1,5,,6,6,6,1,4,,6,6,,,7,,7,1,2,6,,6,6,6,,6,6,,,6,,,,,,6,4,4,4,4,4,4,4,4,4,4,4,7,4,4,4,3,3,3,3,4,3,3,4,4,3,3,3,3,3,3,3,3,6,7,6,,,6,7,7,6,7,7,,,,,,,,,,,,,,,,,,,,,,,,,,,
Polly,Lin,20 months,4,1,7,7,7,6,7,6,2,7,7,7,1,2,7,6,7,2,3,7,1,7,7,7,7,6,7,6,6,7,7,6,6,7,7,7,7,7,7,6,7,7,7,7,7,6,7,6,7,7,7,5,5,5,5,5,4,5,5,5,5,5,5,5,5,5,4,5,7,7,7,7,6,6,7,7,7,7,7,7,7,7,7,7,7,6,7,7,7,7,6,7,7,7,7,6,7,7,6,7,7,7,6,"Polly always comes up with innovative and challenging ideas, also excels in communication and coordination. She proposed the idea of automating the Sourcing and Bid-Waiver process flow by Power Automate. She diligently collaborated with team members to achieve this goal, which made an impactful contribution to APAC Procurement team.","A suggestion for Polly would be to exhibit more fearless in the relationships with subordinates or others when encountering conflicts, to prevent the potential losses by excessive consideration.","Polly is the best supervisor I have ever encountered in my career. She is very understanding and deeply cares about the growth of her subordinates, both professionally and personally. Her innovative thinking has enabled us to accomplish many challenging tasks together, from which I have learned a great deal. I am extremely grateful for the opportunity to work with Polly; she is the role model of my career."
Polly,Lin,24,1,2,7,6,7,7,6,3,2,6,7,6,2,2,6,6,7,2,2,7,3,7,7,7,6,6,6,6,6,6,6,6,6,7,7,7,7,6,6,6,6,6,6,6,6,6,6,6,6,6,6,5,5,5,5,5,5,5,5,5,4,4,4,4,4,4,4,4,7,7,7,5,5,5,5,5,7,7,5,7,6,6,6,6,6,6,6,6,6,6,7,6,6,7,6,6,6,6,6,5,6,6,6,"When working with others, Polly has the ability to quickly build trust and create an environment of respect. She is able to build relationships through her interpersonal skills and trust through her strong work ethic and timely delivery of actions. Polly is also a great listener and demonstrates that she values other people's opinions and is considerate of individual differences.",Polly is very meticulous and efficient at accomplishing her tasks.  An opportunity for Polly is to delegate and share responsibilities of tasks which can reduce individual stress and workload.,"I am really impressed with Polly's ability to connect the dots, embrace an enterprise mindset and work across boundaries in a global capacity."
Polly,Lin,20 months,4,1,7,7,6,6,7,6,2,7,6,7,2,4,2,7,7,2,3,7,1,7,7,7,7,6,7,6,6,7,7,6,6,7,7,7,7,7,7,7,7,7,7,7,7,7,7,6,6,6,7,5,5,5,4,5,4,5,5,5,4,4,5,5,4,5,4,4,,,,,,,,,,,,,,,,,,,,,,,,,,,,,,,,,,,,,,
Josephine,Marino,48,6,,,,,4,,,,,,,,,,,,,,,2,,,,,,,,,,,,6,6,6,6,4,4,4,4,6,4,4,4,4,4,4,6,4,4,4,2,2,2,2,2,2,2,4,4,3,2,3,4,2,2,2,2,,,,6,,,,,,5,,,1,7,4,,4,4,6,6,7,6,7,7,7,4,4,4,4,4,5,4,5,4,5,NA,Expectation setting,"She's approachable, warm, and direct. "
Josephine,Marino,48,2,2,6,5,4,5,5,3,3,4,4,6,3,6,7,5,6,6,3,6,6,6,6,6,6,6,6,5,3,5,6,,5,6,3,5,6,5,,5,5,4,5,5,3,5,5,6,6,5,6,4,4,4,4,3,4,4,4,3,4,4,3,4,4,3,4,4,6,6,6,7,6,7,7,7,6,7,6,7,5,6,,7,7,6,4,5,5,4,,5,4,5,5,5,6,4,5,6,5,6,5,She is very well organized and knows the details.,She needs to know when to put effort into an issue and when to let one go. ,N/A
Josephine,Marino,48,5,2,6,,7,6,6,4,4,6,6,6,2,2,7,4,7,,2,6,1,6,6,6,6,,6,,,6,6,,6,,,6,4,4,4,6,6,4,6,6,6,4,6,5,5,4,4,4,4,4,4,2,2,2,2,2,4,4,4,4,4,4,4,4,5,5,6,7,6,,,6,6,7,6,7,5,6,5,5,5,4,4,6,5,4,6,4,6,4,6,4,4,6,5,6,6,6,4,"Collaboration
Josephine takes the time to work on collaboration between herself/company and ours as an external vendor, often sharing our capes broadly to other areas of the business. ","
I believe enhancing approachability could further strengthen the effectiveness of our communication and interactions. While our rapport has developed over time, I believe openly fostering approachability from the outset could have accelerated our connection even further.","
Working alongside Josephine is truly a delight; she exemplifies a genuine partnership mentality and consistently demonstrates a keen understanding of the broader perspective."
Josephine,Marino,9,3,1,6,7,7,7,7,2,2,6,7,6,2,5,7,7,7,1,2,7,2,7,7,7,7,7,7,7,7,7,7,7,7,7,7,7,7,7,7,7,7,7,7,7,7,7,7,7,7,7,7,5,5,5,5,5,4,5,5,4,1,1,1,1,1,1,1,1,7,7,7,7,7,7,7,7,7,7,2,6,6,6,4,4,4,4,7,7,7,7,6,5,7,7,6,6,5,7,7,7,7,7,6,Josephine is an exceptional communicator. She makes it her goal to ensure everyone is caught up and fills in any missing details to allow the team to have the full picture. She is always willing to communicate important information to keep the day to day moving in the right direction. ,"Josephine can improve upon providing more information off the bat to help get started on a project or task. She tends to provide just the right amount of information to initiate a project, but it can sometimes result in a follow-up to gain a better understanding of more complex projects. ","Josephine is a great leader, she caters to her people, embraces diversity, embraces autonomy, and celebrates all the hard work her team contributes in the day to day. She is extremely reliable and always backs her team in any given situation. She welcomes continual feedback, which in turn, allows herself and the team to grow. "
Josephine,Marino,24,3,2,5,5,5,6,6,4,3,6,6,6,3,4,5,5,6,3,4,5,3,5,5,6,5,5,5,4,4,5,4,4,4,5,5,5,6,6,5,5,6,6,6,5,5,4,5,5,5,4,5,2,2,2,2,2,2,2,3,2,2,2,1,1,1,1,1,1,5,5,5,5,5,5,4,4,5,5,5,5,5,5,5,5,5,5,5,6,5,5,5,4,5,5,5,4,5,5,6,6,6,6,4,"Josephine is very confident, well-spoken, and able to communicate effectively across various cross-functional groups. ",,
Josephine,Marino,36 +/-,5,6,6,6,4,5,7,2,2,5,6,6,2,3,6,6,6,2,2,7,2,6,6,6,6,6,6,4,4,5,6,6,6,6,6,6,6,6,5,4,6,4,6,4,4,4,5,5,4,5,4,4,4,4,4,4,3,3,4,3,3,3,3,2,2,2,1,1,5,5,5,,4,,,,4,3,4,5,6,5,5,,,4,5,6,6,6,4,4,6,4,4,4,4,5,5,4,6,5,4,She is transparent and addresses issues head on. Factual and business oriented.,,
Josephine,Marino,54,1,2,5,5,6,5,6,2,2,5,6,6,3,2,6,5,6,6,6,6,3,6,6,6,6,6,6,4,5,6,6,6,6,6,6,6,6,6,6,6,6,7,6,5,6,6,6,6,5,6,4,4,5,5,5,4,4,4,4,4,4,4,4,4,4,4,4,4,7,7,7,5,5,4,5,6,7,7,6,6,6,6,6,6,6,6,6,6,6,6,6,6,6,6,6,6,6,6,6,6,6,6,6,,,
Josephine,Marino,36,1,2,5,6,5,6,6,2,2,3,5,6,5,2,5,6,6,2,5,6,2,6,6,6,6,6,6,6,6,6,6,6,6,6,6,6,6,6,6,6,6,6,6,3,6,3,3,5,6,5,6,4,4,4,4,4,4,4,4,4,2,4,4,2,2,2,2,2,5,5,5,3,3,4,5,5,6,6,6,5,5,3,5,5,5,3,5,5,5,4,3,5,5,3,3,5,6,6,6,5,5,5,6,,,
Natalia,Marquezfernandez,12,6,1,6,6,6,4,6,4,2,5,7,6,2,4,7,6,,2,6,6,2,6,6,6,7,6,6,6,4,6,7,6,6,6,6,7,7,6,6,2,6,4,6,6,6,6,6,6,7,7,7,4,5,5,5,3,,4,,5,3,4,5,4,3,4,1,2,,4,5,3,4,5,,4,7,6,,6,6,7,6,6,5,6,6,7,6,7,6,4,2,4,6,6,6,6,4,5,4,4,4,,,
Natalia,Marquezfernandez,12months,1,1,6,6,5,5,6,2,2,5,6,6,2,2,6,6,6,2,2,7,1,6,6,6,6,6,6,6,,6,6,6,6,6,6,6,6,6,6,4,6,7,6,6,6,6,6,6,5,5,5,4,5,4,4,4,3,3,4,4,3,3,2,3,3,3,3,3,7,7,7,6,6,7,,,6,7,6,6,6,6,6,6,5,5,6,6,6,6,5,4,6,4,4,5,4,5,6,4,4,4,4,"Natalia demonstrates strong sense of support to the team, adaptating the way to communicate clearly to present what she does, she makes herself available to complete tasks on time and shares back her finding. Whilst independent in her job, she makes sure she connects with the cross fonctional team to report out her finding and manages issues with external parties very well. external feedback from external artners have been really positive. She has adapted her communciation method to be more effective and knows how to adap communication decks/supports to cross functional team.","She could develop her leadership skills and her network  to further, leverage her amazing work and achievements to high stakeholders. ","It has been  a pleasure to work with Natalia, She is a real strong addition to our cross functional team supporting the D&L projects across EMEA. She is reliable and kind person to work with. look forwards to the SD&PM next steps!"
Natalia,Marquezfernandez,15,2,2,6,6,6,5,6,2,2,6,5,6,2,2,6,6,6,2,2,6,2,6,6,6,6,6,6,4,4,6,4,4,4,6,6,6,6,6,6,6,6,6,6,6,6,6,6,6,6,6,6,3,3,3,3,3,3,3,3,3,2,2,2,3,1,1,1,1,7,7,7,6,6,6,6,6,6,6,6,6,6,6,6,6,6,6,6,6,6,6,6,5,6,5,4,5,4,4,6,5,5,5,6,Natalia naturally makes others feel at ease in group settings which helps her be effective at collaborating with others.,Continue to build working relationships with stakeholders outside of our team.,Natalia is a great asset to our team; I highly value her contributions and collaboration.
Natalia,Marquezfernandez,13,2,7,7,7,6,6,7,4,2,7,7,7,1,1,6,6,7,1,1,7,3,6,7,7,7,7,6,6,6,6,5,5,6,7,7,7,7,7,6,6,7,7,7,6,7,6,6,7,7,6,7,4,5,4,4,5,3,4,3,4,2,2,2,2,2,2,2,2,5,6,6,6,7,7,6,6,7,7,7,6,4,6,5,7,4,5,7,7,7,6,6,6,7,7,5,4,7,6,7,5,5,5,5,"Natalia is an exceptional listener. She is quite good at active listening, and takes time to clarify where she has questions and engage further in the conversation.","Occassionally when Natalia is in meetings and begins discussing something she is extremely passionate about--she becomes very excited and speaks quickly. I greatly value her excitment and enthusiam, but I know that some colleagues can struggle when people speak so quickly. Practicing to communicate in evenly can support her in clearly delivering her message. ","Natalia is a great colleague, who I really value working with. She is positive, creative, and excellent at collaborating to drive projects and processes forward. I know she will do great in this program, and I am really proud of her and know she will be an excellent leader!"
Natalia,Marquezfernandez,24,2,1,5,6,3,3,7,5,6,5,4,6,3,1,7,5,5,1,3,7,6,7,6,6,3,6,3,7,4,7,,,6,7,6,7,5,4,4,7,7,7,7,6,5,5,3,6,4,4,4,4,4,2,2,2,2,2,4,3,1,1,1,2,1,1,1,1,6,6,7,5,1,6,,,6,5,4,3,6,6,3,3,3,7,7,3,6,5,3,3,7,6,3,5,5,7,6,3,5,2,4,"Make sure to include all relevant stakeholders into the loop 
Has been able to listen to customer needs and adapt her way of working 
She is good at reaching out, even remotely, to create a relationship ","Natalia can be so passionate sometimes, about her work, and others, that sometimes, she tends to speak more than to listen. Being able to listen, so that the person can take the time they need to express themselve, is key to establish relationship with stakeholders, colleagues. 
If one does not feel confortable to lead the conversation, then one might feel that maybe they could not share and get their message accross. ","Natalia is passionate about her work, and this makes it really pleasant to work with her. 
She is able to share openly her vision, and ideas, and it makes us feel confident to to the same with her, hence building solid trust. 
She is also enthousiast, and dynamic, therefore bringing another perspective and good energy to our team. "
Natalia,Marquezfernandez,13 months,6,1,7,7,7,7,6,2,1,7,6,7,1,,7,7,7,1,1,7,1,7,5,7,7,7,7,,,7,,,,7,7,7,7,7,7,7,7,4,7,7,7,7,7,7,4,4,7,5,5,5,5,5,5,5,5,5,5,5,5,5,5,5,2,5,7,7,7,7,7,7,7,7,7,7,7,7,7,7,7,7,7,7,7,7,7,7,7,7,7,7,7,7,7,7,7,7,7,4,7,Cooperative and goal-oriented,how to improve to reach a higher level,"I am very satisfied with her cooperation, especially that she makes an effort to do everything with us in German so that we understand the questions correctly."
Natalia,Marquezfernandez,24,3,1,6,7,7,5,,4,2,6,4,6,4,3,7,7,7,1,3,7,1,7,6,6,6,6,6,5,6,6,5,5,5,6,5,6,1,6,6,2,6,6,6,6,5,5,5,5,5,5,5,4,4,5,5,4,4,4,4,4,4,4,4,4,4,4,4,4,7,7,7,6,6,6,6,6,7,7,6,6,6,6,6,6,6,5,6,6,7,6,6,5,7,6,6,5,6,5,7,6,6,6,6,good listener able to find solution,,
Natalia,Marquezfernandez,15,1,1,7,6,5,5,7,1,2,6,5,6,1,2,7,5,7,2,2,7,3,6,6,7,6,5,5,4,5,7,6,5,5,7,6,7,7,6,7,7,7,7,7,5,6,7,6,6,6,6,7,4,5,4,5,4,3,3,4,5,3,3,3,4,3,3,2,2,7,6,6,6,3,5,4,4,6,7,5,7,6,6,7,7,6,6,6,7,7,6,7,5,7,5,5,6,7,6,7,6,7,5,5,Natalia is able to quickly establish her credibility within a new group.  She manages this through preparation and an ability to learn new content quicky.   This is key to the success of our work where we are often asking people to go on a journey with us when they don't really know where/how it is going to end. ,Natalia can share more of her experiences before MSD.  I would like to hear more about how other companies handle the challenges we have here in order to leverage the diverse backgrounds we have brought together in the team.  ,"Have fun, be open to the experience and share with us what you learn!"
Natalia,Marquezfernandez,16,3,6,4,4,5,3,2,5,4,3,3,3,4,6,3,5,6,5,6,5,6,2,3,3,4,4,4,4,4,4,4,4,4,4,4,3,4,3,3,4,3,4,3,3,3,3,3,4,4,4,4,2,2,2,3,2,2,2,2,2,2,2,2,2,2,2,2,2,4,4,4,2,,4,6,6,,,,3,4,4,4,5,4,6,5,5,6,3,6,2,5,6,5,7,3,3,3,4,4,4,4,Easily gets into open conversations. ,Connect and network with stakeholders that are important to/for her current role as well.,
Natalia,Marquezfernandez,10,6,2,6,7,5,6,7,2,2,4,6,6,4,4,7,7,7,2,2,6,2,6,6,6,6,6,6,5,4,6,6,6,6,6,6,6,6,6,6,6,6,6,6,6,6,6,6,6,6,6,6,4,2,2,4,4,1,3,4,4,4,4,4,4,4,4,1,1,7,7,7,5,7,,,,7,7,4,6,,6,6,6,6,4,6,6,6,6,6,6,6,6,4,4,5,5,5,4,4,4,4,Encourages and acknowledges team work and achievement. ,,
Natalia,Marquezfernandez,6,3,2,6,5,6,6,6,5,2,6,6,6,3,5,6,6,6,2,3,6,2,6,6,6,6,6,6,6,6,6,6,6,6,5,3,5,,,,,,,,,,,,,,,,,,,,,,,,,,,,,,,,,,,,,,,,,,,,,,,,,,,,,,,,,,,,,,,,,,,,,,
Natalia,Marquezfernandez,12,2,1,6,6,6,3,5,3,7,5,5,6,4,3,6,7,7,6,2,6,5,6,7,7,6,6,6,4,4,6,4,4,5,6,6,6,6,6,5,1,6,4,6,6,5,4,4,6,6,4,5,2,2,2,1,1,1,2,2,2,2,1,1,1,1,1,1,1,7,6,6,6,6,7,7,7,6,6,5,6,6,7,5,6,3,6,2,2,5,4,6,6,6,5,5,6,3,6,6,5,4,3,4,"Natalia is not afraid to get new assignments and also very helpful to coordinate activities that involves multiple team members. 
She is also great on presentations, when she get prepared, she can be very objective and inspiring, e.g. ISO overview at SDPM staff mtg.","Natalia could be more objective when speaking in a group or when she is trying to sell an idea or whenever she needs to make a comment. Sometimes she thinks out loud while she is talking and she fails to send the message concisely, loosing the audience. E.g.: During our weekly internal team meetings with MG's team. ",
Natalia,Marquezfernandez,12,2,2,6,6,5,6,6,3,2,6,4,6,,,6,6,6,6,2,6,2,4,6,6,5,6,5,5,4,6,6,6,6,6,6,7,5,6,5,6,6,6,6,6,5,6,6,6,7,6,5,3,4,4,4,4,4,4,4,4,3,3,4,5,4,2,2,2,7,7,7,7,7,7,7,7,6,7,7,7,6,6,6,5,5,4,6,6,6,5,4,5,6,5,4,4,6,6,6,4,5,4,4,,,
Natalia,Marquezfernandez,14,2,1,,7,6,6,7,4,2,4,,6,2,4,7,6,6,2,2,6,2,6,6,6,6,6,6,,,6,4,4,6,6,6,6,6,6,6,6,6,6,6,7,7,4,6,6,4,4,6,4,4,4,4,3,2,2,3,3,2,2,2,2,2,2,3,3,7,6,6,6,6,6,7,5,6,6,5,6,5,5,5,5,5,5,6,6,6,5,6,5,6,5,5,5,6,6,6,5,6,5,6,"Natalia connects very well with stakeholders, always trying to understand their pain points to bring to the table solutions that may fit their needs","I believe that Natalia has the opportunity to improve her connections with leaders, socialize with senior leaders to build meaningful connections is one of the core activities of her role. She may does this through 1:1's or setting up open conversations to dive into business challenges and how her work could contribute to close out those gaps","Natalia is an outstanding person and has been an important member of SDPM, I really enjoy the energy and enthusiasm that she bring to everything that she does, I hope to keep working an collaborating with her on the years to come. "
Natalia,Marquezfernandez,13,2,1,5,,6,6,6,1,3,,,7,4,1,6,7,7,2,2,6,2,6,6,6,7,7,7,,,6,,,,7,7,7,5,6,4,4,6,6,6,6,6,4,7,7,4,4,6,5,5,3,3,3,1,4,3,1,2,1,2,2,2,2,3,2,6,7,7,4,5,5,6,5,7,7,,4,6,5,5,6,5,4,6,6,6,5,4,4,7,4,4,4,6,7,7,4,7,5,4,Natalia listens well and is generous with giving feedback. Her feedback is generally constructive and she explains her motivations well. ,,
Natalia,Marquezfernandez,10 months,3,1,6,7,6,6,6,2,2,6,6,6,2,1,6,6,7,2,1,6,2,6,6,6,6,6,6,6,,6,,,6,7,,6,7,6,7,6,6,6,6,6,7,6,6,6,6,6,6,4,4,4,4,4,4,4,4,4,4,4,4,4,4,4,4,4,6,6,6,6,6,,6,,7,7,7,6,6,6,6,6,6,4,7,6,7,6,6,6,6,4,4,6,7,6,7,6,6,6,6,,,
Natalia,Marquezfernandez,8,6,1,7,7,7,7,7,2,7,7,,7,4,4,7,7,6,4,5,7,2,7,6,6,7,7,7,7,7,7,7,7,7,7,7,7,6,6,6,6,6,4,7,7,6,7,7,5,6,5,6,4,4,4,4,4,4,4,4,4,4,4,4,4,4,4,4,4,7,7,7,7,7,7,7,4,7,7,6,7,7,7,7,6,7,5,6,7,7,7,5,4,7,4,6,6,6,6,7,6,7,7,6,,,
Natalia,Marquezfernandez,24,3,7,6,6,,6,6,2,5,6,7,7,2,2,7,6,6,6,4,6,4,6,6,6,7,7,7,,,7,,,6,,6,6,6,6,6,6,6,6,6,6,6,6,6,6,4,5,5,2,2,2,2,3,1,2,4,2,1,3,2,2,2,2,2,2,4,7,7,6,7,,,,7,5,6,7,6,7,6,6,5,2,6,3,6,6,4,5,6,4,4,4,6,7,7,4,4,4,6,She is very focused on being inclusive and ensuring that everyone is aligned before moving forward with a decision.,Natalia needs to be more concise on her responses. She often time feels like she has to explain her entire reasoning for most answers. It is not always necessary.,
Steve,Mueller,60 months (5 yrs),2,1,6,7,3,3,6,1,2,6,4,7,2,2,7,7,7,6,2,7,4,7,7,7,7,,7,7,7,7,,,,7,7,7,7,7,7,7,7,7,7,7,7,7,7,7,7,7,7,4,4,4,4,4,1,1,4,1,1,1,1,1,1,1,1,1,5,5,5,7,7,7,7,7,7,7,,,7,7,7,7,7,5,7,7,7,7,5,6,7,7,5,5,7,7,7,6,7,7,7,"He is a very sincere and likable person.  He is very easy to work with and a wonderful human being.  I enjoy working with him very much and think of him as not just a colleague but a friend.  If I have an issue that I need to talk out, I seek out Steve!",I worry that people take advantage of Steve because of his good nature and willingness to help others.  Sometimes I think that people do take advantage of that.,Don't ever change.  The world needs more compassionate and kind people like you!
Steve,Mueller,36,3,1,6,7,7,6,7,2,2,6,7,7,2,2,7,7,7,6,4,7,6,6,6,7,6,7,7,6,6,7,7,,7,7,7,7,7,7,7,7,7,7,7,7,7,7,7,7,7,7,7,4,5,4,3,3,3,3,5,5,5,5,5,3,4,4,4,4,7,6,6,7,6,6,7,7,7,7,7,7,6,6,6,7,6,6,7,7,,7,7,6,7,7,7,7,7,7,7,7,7,7,7,,,
Steve,Mueller,36,2,1,6,6,4,5,7,1,2,4,6,6,4,2,6,4,7,2,1,6,2,7,6,7,6,5,6,4,6,7,4,6,4,7,6,6,6,6,4,4,6,7,4,6,4,4,6,4,6,5,4,3,3,2,2,3,2,2,3,3,2,1,1,2,1,1,1,1,6,5,6,4,3,5,6,4,5,6,4,6,6,5,5,5,5,6,6,6,6,6,5,4,6,6,4,5,5,6,6,5,5,4,4,,,
Steve,Mueller,,3,2,5,6,6,5,5,3,1,5,5,6,3,2,5,5,5,2,3,6,2,5,5,6,6,5,6,7,6,6,5,6,5,6,6,6,6,6,6,6,6,6,6,6,6,5,6,6,4,6,5,4,4,3,4,4,3,4,4,4,2,2,2,2,2,2,3,2,5,6,6,5,5,6,6,6,6,6,6,6,6,5,6,6,5,5,6,6,6,,6,6,6,5,5,4,6,6,6,5,6,4,5,,,
Steve,Mueller,96,3,1,6,6,7,6,6,1,1,7,,7,4,1,6,7,7,1,1,7,4,6,7,7,5,7,6,4,7,7,5,5,6,6,7,6,6,6,6,7,6,7,6,6,7,4,6,7,6,6,6,2,2,2,2,2,2,2,2,2,1,1,1,1,1,1,1,1,7,7,7,5,4,5,6,5,6,6,7,6,6,6,6,6,6,5,5,6,6,6,5,5,7,7,5,4,5,4,6,4,6,5,4,Great listener. Many times he has listen carefully to my problems and helps me solve it.,"While fixing problems is Steve's strength, he can also provide larger context about how the problem is being resolved long term or how root causes are being fixed.",Steve is awesome! Very professional and easy to work with.
Steve,Mueller,72,3,1,4,7,6,6,7,2,2,5,7,7,,2,6,6,7,1,4,6,2,6,7,7,6,7,7,6,5,7,7,7,7,7,7,7,7,7,7,7,7,7,7,7,7,7,7,7,7,7,7,4,5,4,4,4,4,5,5,5,4,3,3,4,4,4,3,3,7,7,6,5,4,7,6,6,7,7,7,5,5,7,6,6,6,6,7,7,7,7,7,6,7,7,7,6,6,7,7,6,7,7,6,"He is extremely knowledgeable of our policies, procedures and systems and he is always willing to lend his expert hand to others, without hesitation always with a smile on his face and in a fast fashion.",I think sometimes people may take advantage of his nice nature.  He should be more outspoken at times and express more his opinions.,no
Steve,Mueller,36+,2,1,6,4,6,6,6,2,1,6,5,6,2,1,7,6,7,1,2,7,2,7,7,7,7,7,7,7,7,7,7,7,7,7,7,7,6,7,6,7,7,7,7,7,7,7,7,7,7,7,7,4,4,4,4,4,4,4,4,4,2,2,2,2,2,2,2,2,7,7,7,4,5,5,7,7,7,7,7,7,7,7,7,7,7,6,7,7,7,7,7,7,7,7,7,6,6,7,7,6,6,6,6,"Steve is an excellent communicator.  He is clear and concise, with well-organized thoughts that are easy to understand.  This is particularly helpful when explaining ideas and processes. ",,
Steve,Mueller,several years,3,1,6,7,3,4,6,1,2,6,6,7,2,2,7,4,7,1,2,6,2,6,6,6,6,6,7,5,5,7,5,6,6,7,7,7,7,7,7,7,7,7,7,7,7,7,7,7,7,7,7,4,4,4,4,4,4,4,4,4,4,4,4,4,4,4,1,1,7,7,7,5,4,7,7,7,7,7,7,6,6,6,6,6,6,6,7,7,7,6,6,5,7,7,7,7,6,7,7,6,6,6,6,"Steve is genuine and displays emotional intelligence.  In meetings or working on a team, he is flexible, actively listens to the opinions of others, and displays empathy.  ",,
Steve,Mueller,48+,1,1,5,7,3,6,7,1,2,6,7,7,3,1,6,6,7,1,2,6,6,6,7,7,7,7,7,6,7,7,7,7,7,7,7,7,7,7,7,7,7,7,7,6,7,7,7,7,7,7,7,5,4,4,3,3,3,2,3,3,2,2,2,2,2,2,2,2,7,7,7,7,6,6,7,7,6,7,7,6,5,6,6,6,5,7,7,7,7,7,7,6,7,7,7,7,7,7,7,7,7,6,7,"Steve is knowledgeable about the interdependent objectives and processes to help his team and others succeed.  He is very intentional to support where he can.
While training the Procurement Sourcing and Contracting Central Functions team, Steve was deliberate in the training material and explanations to help the team succeed. ",Steve is a subject matter expert in various process in Procurement. I would like for him to drive some of the optimizations and improvements to reduce redundancy in our processes. ,
Steve,Mueller,50,3,2,7,7,7,7,7,3,2,7,7,7,2,2,7,6,6,6,3,6,1,7,7,7,6,6,7,7,7,7,6,6,7,7,7,7,7,7,7,7,7,7,7,7,7,7,7,7,7,7,7,4,4,5,4,5,4,4,5,4,5,5,5,4,4,4,4,4,7,7,7,7,7,7,6,7,6,7,7,6,7,7,7,7,7,7,7,7,7,7,7,7,7,7,7,7,7,7,7,7,7,7,7,Steve is exceptional providing guidance on how to do things simpler.  He is an amazing communicator and he explain things in ways that everyone understands.,"Steve is shy when asking for help.  So before asking, he always explore all possible options.",He just knows the right thing to say or to do.  Everybody likes to work with him.  He gains people's trust easily.
Steve,Mueller,12,3,2,5,6,6,7,7,2,2,6,7,7,3,2,7,7,7,1,1,6,2,6,7,7,6,6,7,4,5,7,4,4,4,7,7,7,7,7,7,7,7,7,7,6,7,7,6,6,7,7,7,4,4,2,2,4,3,4,5,4,2,2,2,2,2,2,2,2,7,7,7,4,4,7,7,7,4,7,7,6,6,6,6,7,6,6,7,6,7,6,7,6,7,7,7,6,7,7,7,7,7,6,6,"Steve is very keen on how he speaks when working with others and understands how to navigate a group dynamic. Even if he disagrees with you, he has a unique way of still making you feel good about your idea. I would say that overall he is a very intuitive group member and understands, very well, how people work and how to effectively interact with them. ",I would like to see Steve step up into the lead role more and share his thoughts/ideas. I think he has a lot of good ideas of how to present information and concepts and I want to hear from him even more. I would love to see him run with an idea or come back to the group with a sketch/draft of his thoughts and ideas of how to implement/drive the result.,"I think Steve would benefit from continuing to grow his network, outside of the procurement area. He has a lot of great ideas and knowledge within the space he currently works. I think if he could continue to grow that network and continue to connect dots to different areas and the larger picture, he would be even more effective in his current and future roles."
