Diana,Quintero,12,2,2,4,6,3,3,7,2,6,4,6,6,4,4,7,6,6,6,2,6,4,4,6,6,6,4,5,5,4,6,6,6,6,6,4,6,6,6,6,6,6,6,,6,6,6,6,6,6,6,6,2,2,2,2,2,3,3,2,4,3,2,2,3,3,2,2,3,5,4,4,2,3,3,4,7,7,6,6,6,6,7,6,5,4,3,7,4,5,5,4,4,3,4,5,5,5,5,5,5,6,5,5,,,
Diana,Quintero,12,4,1,7,7,7,1,7,3,1,7,7,7,1,1,7,7,7,1,1,7,1,7,7,7,7,7,7,7,7,7,7,7,7,7,7,7,7,7,7,7,7,7,7,7,7,7,7,7,7,7,7,5,2,5,5,5,2,5,3,5,2,1,1,3,1,4,5,4,7,6,7,7,7,6,6,7,7,7,6,7,6,7,7,6,7,6,7,7,7,7,7,7,7,7,7,5,6,7,5,7,6,5,3,Manage the resources. She clearly understand how to manage the team and how to divide the responsibility to each member. In our daily or specific tasks she always step ahead to get the plan she has to get it done the most effective way possible.,Sharing more about her experiences would be really a great idea to learn from her and how to act when a tough situation comes up.,Diana is a fantastic manager and knows how to communicate but when to do it. She is really smart and is always steps ahead from the others.
Shanetta,Robinson,18,6,1,5,5,5,4,6,2,2,4,5,6,3,4,7,5,6,2,2,5,2,6,5,6,6,6,6,4,4,6,6,6,5,6,6,6,6,6,6,6,6,7,6,4,5,4,5,5,4,4,4,2,4,2,3,4,2,5,5,5,3,2,2,3,2,1,2,2,5,5,5,4,4,4,5,4,5,6,6,5,5,5,5,6,5,5,7,6,7,6,6,5,7,6,5,5,7,6,7,6,6,6,5,"Shanetta is very organized and focused on the objectives in our projects together, notably the ERM meetings we have together between our companies.",Shanetta can upskill on influencing her internal decision makers to gain more favorable outcomes.,
Shanetta,Robinson,24 months,2,1,7,7,7,7,7,1,1,6,6,7,2,1,7,7,7,1,2,6,1,7,7,7,7,7,7,7,7,7,7,7,7,7,7,7,7,7,7,7,7,6,6,6,6,6,6,6,6,6,6,4,4,4,4,4,4,4,4,4,4,4,4,4,4,4,4,4,7,7,7,7,7,7,7,7,7,7,7,7,7,7,7,7,7,6,6,6,6,6,6,6,6,6,7,6,6,6,6,6,6,6,6,"I have the privilege to work in some activities associated with a specific supplier alongside Shannetta. She has an exceptional ability to promote collaboration and unity among team members. During our meetings with the supplier, she always demonstrates leadership by example and allowed everyone to voice their ideas, creating an environment of respect and mutual support.",I enjoy working with Shanetta as I learn daily with her. I would not have any considerations at the moment. ,"Shanetta, your contribution to SD&PM goes beyond the day-to-day tasks - your positive attitude and energy during our meetings and business trips always lead to morale boost. Your genuine interest in supporting others and proactive efforts in helping others grow professionally is truly inspiring.  Keep shining!"
Shanetta,Robinson,Over 24,6,1,6,6,4,4,,2,1,7,6,6,1,1,7,6,7,6,4,6,1,6,7,7,7,,7,,,7,7,6,7,7,7,7,7,7,6,4,6,4,6,6,4,4,6,4,6,4,4,5,5,4,4,4,1,5,3,5,4,4,4,1,3,3,1,1,7,7,6,4,,6,,6,7,7,,6,6,7,7,7,7,4,7,7,7,6,4,4,7,6,4,6,4,4,6,4,6,4,4,Shanetta does a very good job communicating during meetings and after meetings for follow ups and task completions.  Dedicated to her work and is a pleasure to work with on a regular basis.,I can't think of anything to improve upon.  She does a great job with us.,"Keep doing what you are doing.
"
Shanetta,Robinson,15,6,1,7,7,7,6,7,1,1,6,7,7,1,1,7,7,7,4,1,6,1,7,7,6,6,6,7,,,7,7,7,7,7,7,7,6,7,4,7,6,7,7,7,7,6,6,7,4,4,4,2,4,4,4,4,4,4,4,4,3,3,3,3,3,3,3,3,7,7,7,5,6,6,7,7,6,7,6,6,4,6,6,6,6,4,7,6,6,6,4,6,7,6,4,4,6,7,7,7,7,6,6,"In my working relationship with Shanetta, I've noticed her exceptional drive in working together towards solutions in a collaborative way. Even during highly stressful periods, the collaborative approach, which Shanetta naturally brings, works wonders. The non collaborative approach; which a lot of customers adopt, often doesn't lead to the hoped for outcomes. ","In certain situations I believe it could to be good to be even more decisive and to lead the way forward; especially when it comes to deciding without having all details available. It's good to take decisions based on information, yet sometimes high level information is plenty to take a decision. ",
Shanetta,Robinson,24,6,2,5,6,5,4,7,2,3,4,5,6,4,3,6,6,6,2,3,6,2,6,6,6,7,6,6,4,,6,6,,6,,6,6,6,6,4,4,6,6,6,5,4,4,4,5,4,5,6,4,4,4,5,4,2,3,3,4,2,3,2,4,2,2,2,2,5,4,6,5,4,5,5,5,6,6,4,5,4,5,5,6,4,6,6,6,7,6,6,5,7,6,6,6,6,5,7,5,6,5,4,"Shanetta listens well. She focuses on what being said, rather than immediately turning to what her response will be.",,
Shanetta,Robinson,16,2,1,7,6,6,6,7,1,1,6,5,7,2,1,6,6,6,1,2,7,1,7,7,7,7,7,7,4,5,7,5,5,5,7,7,6,7,7,7,7,7,7,7,7,7,7,7,7,7,7,7,4,4,4,4,4,4,4,4,4,4,4,4,4,3,3,4,3,7,7,7,4,5,5,4,4,7,7,7,6,4,7,6,,5,4,7,7,7,7,7,7,7,7,5,5,7,7,7,5,7,7,7,Shanetta has very strong interpersonal skills and soft skills and is able to work well with anyone.  ,,
Shanetta,Robinson,18,6,2,5,5,5,5,7,1,2,6,6,6,2,2,6,6,4,2,3,2,5,6,5,6,6,6,6,4,5,5,6,4,6,7,7,6,6,6,5,6,5,6,5,6,6,6,6,5,5,4,4,2,3,3,3,2,2,3,4,3,4,3,4,3,3,3,3,3,6,6,6,5,4,,4,3,7,7,6,5,5,6,3,4,3,5,7,7,7,7,7,6,7,6,6,6,6,4,7,3,7,6,6,,,
Shanetta,Robinson,18,1,1,3,6,5,4,6,2,5,3,2,6,5,4,6,6,5,4,1,6,3,4,4,5,5,6,6,4,4,5,6,6,4,6,6,6,5,5,5,4,6,6,4,3,4,3,6,5,4,4,4,2,3,3,3,2,3,3,3,3,1,1,1,1,1,1,1,1,5,5,4,2,2,5,3,1,4,5,4,3,2,3,3,3,3,6,6,4,6,6,4,6,6,5,3,3,6,6,6,6,5,5,5,Shanetta has a calm composure and is able to communicate effectively even during challenging situations. ,"During report outs and presentations, more proactive preparation of any topic she is leading or/and supporting. Proactive preparation will enable Shanetta to better field and answer questions that come up. By doing this, it will demonstrate to audience that she is the subject matter expert of the topic and goes above and beyond of the minimum expectations. ",Continue to develop leadership skills that will help her influence others and continue to make her point come across more effectively. 
Shanetta,Robinson,36,3,2,6,7,,6,7,1,1,6,,6,1,1,7,6,7,1,1,7,1,7,7,7,7,6,6,,6,7,7,7,7,7,7,7,7,7,7,7,7,7,7,7,7,7,7,7,7,7,7,5,5,5,5,5,5,5,5,5,4,4,4,4,4,4,2,2,7,6,7,6,5,,6,,6,7,5,5,5,6,6,6,6,3,6,6,6,6,6,7,7,6,5,4,7,7,7,6,6,6,5,"Her job is tactical, and it requires to manage escalated risk that have the potential to disruption the company supply chain.  She remains hyper-focused on key milestones and will highlight gaps in achieving those milestones, and she ensures tasks are completed on or before the due date.  Processing a supplier's multi-site change control is an example.  Her positive engagement with key stakeholders within the company and external, enabled the team to work through what should have been challenging, very smooth and efficient.","While she is very adaptive to different social styles, she could be more assertive with stakeholders that are too lax.","Shanetta is well respected within our organization, and external stakeholders.  She should continue to develop her leadership skills and consider opportunities to develop her strategic long term planning skills that will lead to making impactful changes to how the organization does business."
Shanetta,Robinson,12,3,4,4,4,5,5,5,3,5,4,4,5,4,4,3,5,5,4,2,5,4,5,4,4,5,5,5,4,4,5,5,4,5,4,5,5,4,4,4,6,6,6,6,5,6,4,5,5,5,4,4,3,3,2,3,2,2,3,3,2,2,2,2,2,2,2,2,2,5,5,5,4,2,,3,,4,5,4,5,,6,5,4,4,4,7,6,6,5,5,4,6,6,6,4,6,6,5,6,5,4,4,Shanetta has very good demeanor during meetings with the suppliers.,Can improve on sharing information and status with everyone involved. ,
Shanetta,Robinson,N/A,5,2,7,6,7,5,7,1,2,5,6,6,3,3,7,6,7,1,2,6,2,5,5,7,7,5,7,6,6,7,7,6,6,7,7,7,7,7,7,6,7,7,7,6,6,7,7,6,6,6,6,3,3,3,3,3,3,4,4,4,4,4,4,4,4,3,2,2,6,7,7,6,7,7,7,6,7,7,4,6,7,7,7,7,7,5,7,7,7,7,7,6,7,7,7,6,6,6,7,6,7,6,6,One thing that Shanetta does very well when working with others is gathering all perspectives and ideas for a given problem or project before establishing a solution,One thing that Shanetta can do better to improve is to delegate more tasks to her team members to help alleviate the stress off of her,"Reflect more on your accomplishments and rest easy, knowing that you are more than qualified to lead highly effective teams"
Shanetta,Robinson,30,3,2,6,6,7,7,7,2,1,6,6,7,2,2,7,7,7,2,2,7,1,7,6,6,7,6,6,5,6,7,6,6,6,7,7,6,6,7,6,6,7,7,6,6,6,6,7,6,6,6,6,4,5,5,4,5,4,4,5,5,4,4,4,5,4,4,5,4,7,7,7,6,7,7,7,7,7,7,6,6,5,5,6,6,6,4,6,7,7,6,7,6,7,6,5,5,6,6,7,5,6,6,6,"Shanetta is exceptional at building relationships and at collaboration. This was evident during the work to improve supplier, Amcor's, supply performance. ",I encourage Shanetta to continue to meet and develop relationships with suppliers' senior leadership. ,
Shanetta,Robinson,34,1,2,7,7,7,7,7,1,2,,6,7,1,1,7,7,7,1,1,7,1,7,7,7,7,7,7,6,,7,6,7,7,7,7,7,6,7,7,7,7,7,7,7,7,7,7,7,6,6,7,4,4,4,4,5,4,5,5,5,4,3,4,4,3,3,3,3,7,7,7,6,6,7,7,7,7,7,6,6,7,7,7,7,6,6,7,7,7,7,7,7,7,7,7,7,7,7,7,7,6,7,7,Shanetta is great at bringing teams together to work toward a common goal.  Frequently during supplier improvement plan meetings she needs to coordinate many stakeholders (internal and external) and align on problem statements and action plans for solutions.  Shanetta includes all feedback and interacts well with all team members.,"Shanetta should keep building her confidence in leading teams.  As she continues to work in the CSM space, she is gaining confidence in her role and knowing when to speak up to both suppliers and internal stakeholders.",
Shanetta,Robinson,30,3,1,6,6,4,5,5,6,2,6,4,7,2,2,5,6,6,2,2,6,1,6,6,7,6,7,7,,,6,4,,5,7,,6,6,6,5,6,6,7,6,7,6,6,6,6,7,6,6,4,4,4,3,3,4,4,4,3,3,1,2,2,2,2,2,2,6,6,6,6,7,7,6,5,7,6,6,6,,6,6,6,6,6,6,5,6,6,6,6,5,5,4,4,7,6,6,4,6,4,4,Shanetta is a good team player and manages to keep everyone engaged in all discussions led by her.,"She could look for ways to improve her communication skills, keep things simple and straight to the point. This would help her convey her messages more efficiently and effectively.",None.
Ryan,Romack,12,3,1,6,7,6,6,7,5,1,6,6,6,2,1,6,7,7,,2,7,6,,5,7,7,6,7,,,7,6,6,6,,7,7,7,7,6,7,7,7,7,7,6,6,7,7,6,6,6,5,5,4,4,4,5,5,4,4,1,1,1,1,1,1,1,1,7,7,7,5,7,7,7,7,7,7,5,7,7,7,6,7,6,5,7,7,7,6,7,6,7,6,4,4,4,6,6,6,6,6,4,,,
Ryan,Romack,60+,2,2,7,5,6,6,6,2,2,6,4,6,2,2,7,6,7,1,3,7,2,7,7,7,7,6,6,4,4,6,6,6,7,7,6,6,6,6,4,6,6,6,4,6,6,4,6,4,5,4,4,4,4,3,3,3,2,2,5,3,3,3,3,4,3,3,3,3,7,7,7,7,6,7,7,6,6,7,6,7,7,7,7,7,7,5,6,6,5,5,7,4,7,6,6,6,6,7,7,6,7,6,4,"Ryan began her career in the company as a co-op and over the years she has consistently gone out of her comfort zone in order to continue growing. She is open to trying new things and always eager to learn. This has served her very well and she has moved up rather quickly. She stays humble and hasn't let her success go to her head, which helps her connect and maintain relationships as she climbs the ladder. ","At one point I was concerned that Ryan used the word I more than us when working on a team. However, I have seen great improvement with this and as she grows as a leader she is conscious of the importance of sharing the glory with those helping to achieve the goal. She has certainly grown as a leader over the years and continues to have a bright future. ",
Ryan,Romack,15,1,2,6,5,7,6,5,2,2,6,5,6,2,2,6,7,7,6,2,6,3,6,5,7,6,,6,4,,7,5,5,6,4,4,6,5,5,7,7,6,5,5,5,6,5,4,4,6,6,6,4,4,4,4,3,3,3,4,4,2,2,2,3,2,2,2,3,7,7,6,5,4,7,7,7,7,6,6,6,5,5,7,6,6,5,5,6,7,6,6,5,6,6,6,5,4,6,7,6,6,5,6,,,
Ryan,Romack,24,5,1,7,7,4,6,7,1,1,7,7,7,1,1,7,7,7,1,1,7,1,7,7,7,7,4,7,7,7,7,7,7,7,7,7,7,6,6,6,6,6,6,6,6,6,6,6,6,6,6,6,5,5,5,5,5,5,5,5,5,5,5,5,5,5,5,1,1,7,7,7,7,7,7,7,7,7,7,7,7,7,7,7,7,7,7,7,7,7,7,7,7,7,7,7,7,7,7,7,7,7,7,7,"Ryan has a unique ability to align Merck's vision, mission and values with her team's goals, and a driver of her career growth and development. In her ability to do this, people that work with her are authentically driven by her contagious energy to work smarter and more effective, ultimately driving the organization's mission.",,"For lack of a better phrase, Ryan ""just gets it."" Her communication skills are powerful yet humble. She can be effective in conversations with senior leaders of Merck, and at the same time relatable and encouraging with those that work for her. "
Ryan,Romack,24,3,2,6,5,6,6,7,4,3,3,5,7,2,1,6,7,7,3,2,7,4,4,5,7,6,6,7,,,6,6,6,6,4,4,3,3,5,7,3,6,6,7,6,4,7,6,6,7,4,4,1,1,1,2,2,2,2,2,2,1,1,1,1,1,1,1,1,7,7,7,4,3,5,4,,7,7,7,3,3,4,4,5,4,5,6,7,6,6,5,4,7,5,5,4,5,6,6,5,5,4,4,,,
Ryan,Romack,36,1,1,7,6,6,6,6,2,1,7,6,7,2,2,7,5,7,1,2,7,2,6,6,7,4,5,6,4,6,6,4,4,5,7,6,6,6,6,4,6,6,6,6,6,5,4,7,6,5,4,6,,,,,,,,,,,,,,,,,,,,,,,,,,,,,,,,,,,,,,,,,,,,,,,,,,,,,,,
Ryan,Romack,36,2,2,6,4,4,6,6,1,7,6,6,6,2,4,6,4,7,2,7,7,2,6,6,6,6,6,6,6,6,6,6,6,6,6,6,6,6,6,5,6,6,6,6,6,6,6,6,6,6,6,6,5,5,5,5,4,4,4,4,3,1,1,1,3,2,2,2,2,7,7,7,6,6,6,7,7,5,7,4,6,6,6,6,6,6,5,6,6,6,5,6,5,6,6,6,6,6,6,6,6,6,6,6,Ryan is an active listener. He is open to ideas and always can offer great intelligence and ideas to challenging situations. ,,
Ryan,Romack,30,1,2,6,5,4,5,6,1,3,6,6,6,3,1,6,6,7,2,5,6,2,7,7,7,5,6,6,5,5,6,5,6,6,6,7,7,6,6,5,6,6,6,7,5,6,6,6,5,6,6,6,4,4,4,4,4,4,5,4,5,4,4,4,4,3,4,4,3,6,5,7,5,4,7,6,6,6,,6,6,6,6,7,6,7,5,7,6,6,6,6,5,7,6,6,5,6,6,7,6,5,5,6,"Ryan presents as a very authentic, supportive collaborator. She is diligent, detailed, and I think people trust her.",Ryan should continue to work to delegate tasks so she can free herself up to think strategically.,
Ryan,Romack,12,3,1,6,7,6,6,6,,1,6,6,6,,1,6,6,6,1,2,6,6,6,,6,7,7,7,,,,6,,6,,6,6,6,6,6,6,7,6,6,6,6,6,6,6,6,6,6,4,4,4,4,4,4,4,4,4,2,1,1,1,1,1,1,1,7,7,7,7,6,,7,6,7,7,7,7,7,,6,7,,6,7,7,7,6,6,4,6,4,4,4,4,6,6,6,6,4,4,,,
Ryan,Romack,55,1,2,,6,5,5,6,1,2,5,5,6,2,1,7,6,7,2,5,7,3,7,7,7,6,7,6,5,5,7,6,6,7,5,7,5,5,7,7,7,7,6,7,7,7,6,6,5,7,7,5,,,,,,,,,,,,,,,,,,7,7,6,6,6,7,7,6,4,7,6,3,5,5,6,6,5,5,6,7,7,5,5,4,7,6,5,2,7,7,7,4,5,6,4,"Very high quality of work - always !
She communicates very well and her output is always great in every project. ",1. Be more vocal.  She is an amazing talent and has a lot of insights but at times she will shy away. ,Ryan has grown exponentially on leadership and knowledge.  She is a great asset for my team and she loves learning and personal growth and development.  Hope she gets the best out of this training 
Katrina,Schroeder,24-36,2,1,7,7,2,2,7,1,7,6,5,7,5,1,7,7,5,1,1,5,6,7,7,7,7,7,7,7,6,7,6,7,6,7,7,7,7,7,7,7,7,7,7,7,7,7,7,7,7,7,7,4,5,5,5,5,4,4,4,4,1,1,2,2,1,1,1,1,7,7,3,5,2,7,7,7,7,7,4,5,5,6,5,7,4,7,7,5,7,5,6,5,6,7,6,6,7,7,7,7,6,3,6,Making team members feel welcome/ sense of belonging. Really good soft skills and a lovely person to work with.,"Straying off topic - when answering questions / presenting to leaders. Katrina could work on her communication style, being more concise and answering the question to hand -  can sometimes give the impression she is unfamiliar in the area she is speaking about as she goes off topic, when in fact she is extremely knowledgeable in her field ","Katrina has a bubbly energy about her, which is refreshing. She is willing to help regardless of the ask. She is a joy to work with "
Katrina,Schroeder,24 months,2,1,7,7,7,7,7,1,1,6,6,7,1,1,7,7,7,1,1,7,1,7,7,6,6,6,6,6,7,7,7,7,7,7,7,7,6,6,6,6,6,6,6,6,6,6,6,6,6,4,6,3,3,3,3,3,4,3,4,4,4,4,4,4,4,4,1,1,3,7,7,7,6,6,6,6,6,6,6,7,7,7,7,7,7,5,5,5,5,5,5,5,5,5,5,5,5,5,5,5,5,5,5,"Katrina communicates really well, ensuring that everyone understands the issue or escalation really well. For instance, during a project that we were working together, she meticulously explained her perspective and we were able to align our efforts in an effective manner,",I would not have feedback for improvement as I believe that Katrina works in a very efficient manner.,"Working with Katrina has been a privilege, every opportunity that I had to interact with her she has been respectful, thoughtful and she is always interested in other people's perspective. "
Katrina,Schroeder,36,2,2,5,6,5,4,5,2,2,4,5,6,2,2,3,5,7,3,2,6,4,7,6,6,6,6,7,4,5,7,4,4,6,6,6,6,4,5,6,4,7,7,7,4,6,4,5,6,5,5,5,4,5,4,4,4,3,4,5,4,4,3,3,3,2,2,3,2,6,7,7,5,6,5,7,7,6,7,6,6,7,6,7,6,6,6,7,7,7,6,6,4,7,7,6,5,6,7,6,5,7,4,5,"Katrina listens to other's perspectives to help her understand the issue at hand. For a particular situation, Merck vs. the supplier, knowledge and expectations were not clearly understood and not well communicated across the different groups involved. Katrina contacted all involved parties to understand where and how the disconnect/bottleneck existed and helped resolve the issue in a timely fashion. This enabled all those involved to understand the problem and target the right path for resolution.","Katrina could provide updates to folks thar are peripherally involved in an issue she is managing. For a Merck vs. supplier issue that needed additional teams/individuals to be involved, these folks should also be informed of progress and/or outcome.",Katrina is a pleasure to work with! She shares enthusiasm for her work and enjoys helping others.
Katrina,Schroeder,36 months,2,2,4,6,5,5,6,2,4,4,5,5,3,2,5,5,6,2,3,5,3,5,4,6,4,4,6,3,3,6,6,5,4,4,4,5,5,5,5,4,4,4,5,5,5,4,4,4,5,4,4,2,2,2,3,2,2,2,2,2,2,2,2,2,2,2,1,2,4,4,4,3,2,5,4,5,5,5,5,4,3,4,4,4,4,3,5,6,6,4,4,4,6,5,5,4,6,6,6,5,5,5,5,Katrina is genuine and great listener. Katrina is willing to contribute at all times,Katrina can improve on being more concise when conveying ideas and influencing others.,Katrina is great to work with!
Katrina,Schroeder,at least 24 months,3,1,7,7,5,4,5,2,5,6,4,6,6,2,7,5,6,6,2,6,5,4,4,6,6,6,6,2,2,6,4,4,6,6,6,6,7,7,7,7,7,7,7,7,7,7,7,7,4,4,4,3,3,3,3,3,3,3,3,3,3,3,3,3,3,3,3,3,6,6,6,4,4,,5,5,6,7,,6,6,,6,5,5,5,7,5,6,5,5,3,7,7,6,5,6,6,6,5,3,3,4,Katrina is very aware of people's feelings and is sensitive when communicating.  You never have to worry about Katrina's communications being harsh or unprofessional.,"Because Katrina is so sweet and sensitive in communicating, sometimes that can be viewed by others as being a push over, so Katrina needs to learn to be a little more assertive when communication with suppliers and/or stakeholders that are not meeting our requirements or holding up their end of the deal.  Sometimes being too nice isn't always good.",I just want to point out that the section on values would all be N/A for my working relationship with Katrina. 
Katrina,Schroeder,32,1,5,6,6,6,5,6,2,5,7,7,7,3,1,7,7,7,1,1,6,2,6,7,7,7,6,7,3,6,7,6,6,6,7,7,7,7,7,7,7,7,7,7,6,7,7,6,6,7,7,7,4,5,4,4,4,2,4,5,4,2,2,2,2,1,1,2,1,7,7,4,4,4,7,7,7,4,7,6,6,6,6,6,7,5,6,7,4,7,6,6,5,7,7,6,7,6,7,7,6,5,5,6,"Katrina does a great job of making everyone feel like they are valued and part of the team. She takes the time to make sure people feel comfortable to express their ideas and when they do, she makes them feel heard and valued. Katrina has grown in her confidence tremendously over the past few years and that has shown when she is working in a group dynamic, especially when she is in the lead role.","Katrina could improve when it comes to reporting out information and knowing her audience. Her enthusiasm and knowledge come through very strongly when she presents her ideas but at times, too many details or too long of an overview is given. Understanding her audience and tailoring the message effectively will make her ideas come through even stronger and portray her confidence in the subject matter.",
Payal,Shah,70 months,2,1,7,7,6,6,2,2,1,6,7,7,2,1,7,7,7,1,2,7,1,7,7,7,7,7,7,,6,7,7,7,7,7,7,7,7,7,7,4,7,7,7,7,7,7,7,7,7,7,7,4,5,5,5,5,4,4,5,5,3,3,3,4,3,3,3,3,7,7,7,6,6,7,7,7,7,7,6,6,6,6,6,7,6,4,7,7,7,7,7,6,7,7,7,6,6,7,7,7,7,7,4,Payal is always willing to assist people even if it is not her responsibility.  She is very team focused.  Profit plan every year Payal goes above and beyond to ensure everyone is successful not just her.  ,NA,
Payal,Shah,60,2,2,4,5,4,4,6,3,2,3,4,6,5,2,6,6,6,6,3,5,4,3,4,5,6,5,6,4,4,6,4,6,5,7,5,6,7,5,5,6,6,6,6,6,6,5,6,6,4,5,5,2,4,3,3,2,3,3,4,3,3,3,2,4,1,1,1,1,6,6,5,5,6,4,6,4,7,6,5,5,3,4,3,3,3,3,7,6,6,6,4,5,6,3,3,3,5,6,6,3,3,5,4,"Payal is good at listening to new ideas, putting them in historical context and trying to run with them with the leadership team. She understands why or why not ideas will work and is able to convey it to others. ",Payal doesn't express and implement her own new ideas often enough. Her experience is valuable and must have better ways to do things. ,
Payal,Shah,48,3,1,6,6,6,6,6,2,1,6,6,6,4,4,6,7,6,2,2,7,1,6,6,6,6,6,7,7,6,6,6,,6,,6,6,6,6,6,6,6,6,7,5,6,6,6,6,7,6,7,3,2,2,3,1,2,2,4,2,2,3,3,3,3,3,3,3,6,6,6,6,6,7,5,4,7,7,,6,5,5,5,7,5,5,6,6,6,5,6,3,7,6,6,6,6,6,6,6,6,5,4,"Communicating - whether its an ask, new process, or an action that needs to be taken by a teammate.","At times, she does fall back and rely on a process/person she's comfortable/more familiar with, instead of reaching out to someone directly or using a more efficient process.",
Payal,Shah,43,2,1,6,7,6,6,7,2,1,6,6,7,2,1,7,7,7,2,1,6,1,7,7,7,7,7,7,7,6,7,7,7,7,7,7,7,7,7,7,7,7,7,7,7,7,7,7,7,7,7,7,5,5,5,5,4,4,4,5,5,4,4,4,3,4,4,5,4,7,7,7,7,7,7,7,4,7,7,4,7,7,7,6,7,7,6,7,7,7,7,7,7,7,7,7,6,7,7,7,6,6,7,4,She knows how to be firm yet flexible when directing the aim of the project or task.,"She can use the camera feature more on video conference calls to engage more personally with team members.  This is especially helpful when working remotely so one feels more engaged and can see her facial expressions.  For example, when we conduct team or 1:1 meetings, she rarely turns her camera on and it would be a good way to stay connected to the people or person she's interacting with.",Payal is an extremely valuable team member.  She is so pleasant and amazing to work with.  I've gotten to work closely with her for that last four years and she does whatever she can to help me and make our work as easy and effective as possible.  She truly is sincere when it comes to adopting and working towards make processes more efficient and making our work lives easier.  She's an amazing colleague to work with.
Payal,Shah,100,3,2,6,6,6,6,6,2,2,5,5,6,2,2,6,6,6,6,5,6,2,6,6,6,6,6,6,6,6,6,6,6,6,6,7,6,6,6,6,6,6,6,6,6,6,6,6,6,6,6,6,4,4,4,4,4,4,4,4,4,4,4,4,4,4,4,4,4,7,7,7,6,4,5,6,5,4,6,6,6,5,6,6,6,4,4,6,6,6,6,6,6,6,7,7,4,6,6,6,7,7,7,4,"Payal is a natural leader and make the team follows her.  She faces new challenges or requirements in direct procurement, and she is able to lead the entire global team to new ways of working successfully.",Payal is so good guiding teams that I am sure she can accomplish great improvements to go ahead and beyond expectations. ,Payal is a go to person anytime Direct Procurement is mentioned.
Payal,Shah,36,2,1,6,7,6,6,6,1,1,4,6,7,2,2,7,7,7,4,2,6,4,7,7,7,7,7,7,5,6,7,5,6,7,7,7,7,6,6,6,4,6,6,6,6,6,6,6,6,7,,6,3,4,4,4,4,4,4,4,3,4,4,4,4,4,4,4,4,6,6,7,7,,,7,7,7,7,,7,7,7,7,7,7,4,6,6,6,6,6,4,6,5,6,4,5,4,6,6,6,6,4,Payal is always thinking about how to make processes better and simpler to build capacity for other things and she translates those ideas into actions that truly benefit the organization.  She does this in a well thought out manner and solicits feedback before moving forward with actions.,,"I very much enjoy working with Payal daily.  She is levelheaded, does not overly react to issues or challenges and truly has everyone's best interests at heart."
Payal,Shah,30,1,5,5,7,6,6,6,1,3,3,5,6,3,1,7,6,6,2,2,6,2,6,5,5,7,7,7,5,4,6,6,6,6,6,6,6,7,7,6,6,6,7,6,7,6,2,6,6,5,6,5,2,3,2,4,4,4,2,4,4,2,2,2,3,2,2,2,2,6,6,6,5,4,6,5,4,6,7,4,6,5,5,5,6,5,5,7,7,7,6,5,5,7,7,5,5,6,6,7,6,6,5,4,"Payal is responsible for a large piece of work each year that she owns and coordinates for our function.  Payal is good at helping our broad team across sites and COEs with questions, special templates or 1:1 sessions to work.  Bottom line, Payal goes above and beyond the initial training (that she developed) to help others be successful",I think Payal can proactively meet with folks to understand their problems as it relates to her role and think about ideas to use her skills to address or improve the situation - especially tapping into her passion of data / analytics or GenAI space.,
Sitarah,Sherazee,52,1,1,5,5,6,6,6,2,2,5,6,7,3,2,7,6,6,4,3,6,2,6,6,7,6,6,6,6,6,7,7,7,7,7,7,7,7,7,6,6,7,7,7,7,7,6,5,7,7,6,6,5,5,3,4,4,4,4,5,5,4,4,5,5,5,4,5,5,7,7,7,,6,7,6,5,7,7,7,6,7,6,6,7,5,5,6,7,6,7,4,5,7,5,5,4,4,5,6,7,6,6,5,,,
Sitarah,Sherazee,'+- 36 months,3,4,6,,3,,6,2,2,6,4,7,2,4,6,4,7,2,2,6,2,7,7,7,6,6,7,4,5,7,7,5,7,6,6,4,6,5,6,7,6,4,6,6,7,6,6,7,7,6,6,5,5,5,5,5,5,5,5,5,5,5,5,5,5,5,5,5,7,7,7,7,,,7,7,7,7,7,5,5,6,,6,,6,7,7,7,6,4,4,6,6,4,4,5,7,7,6,7,7,4,"She explains herself clearly when give me tasks. Despite the fact that we only chat on Team as we are in different countries, she is very clear and precise when giving instructions.",She can continue to work the way she does.,It is a pleasure to work with someone like Sitarah.
Sitarah,Sherazee,150,3,7,6,6,7,7,7,2,2,7,7,7,2,2,7,7,7,1,1,7,1,7,7,7,7,7,7,7,7,7,7,7,7,7,7,7,7,7,7,7,7,7,7,7,7,7,7,7,7,7,7,5,5,5,5,5,5,5,5,5,5,5,5,5,1,1,1,1,,,,,,,,,7,7,7,,,,,,,6,6,7,7,7,7,7,7,7,7,6,4,4,4,4,4,4,4,Listening. Sitarah is always open to feedback and suggestions. Having an open mindset and receptive to ideas makes it a fulfilling experience working with her.,No Comments,No comments.
Sitarah,Sherazee,120,2,1,7,7,6,6,7,6,4,7,7,7,4,4,6,6,6,4,4,6,2,4,6,6,6,6,6,6,6,6,6,6,6,6,6,6,1,6,6,4,6,4,6,6,6,6,6,6,6,6,6,5,5,5,5,5,5,5,5,5,5,5,5,5,5,5,5,5,7,7,7,7,7,7,7,7,7,7,7,6,6,6,6,6,6,6,6,6,6,6,6,6,6,6,6,6,6,6,6,6,6,6,6,she pay attention to every single detail and she give all advices needed very specifically ,nothing except to increace the F2F meetings in the countries ,i would like to thank Sitarah for all her effort that has been done 
Sitarah,Sherazee,72,3,1,6,7,5,6,6,1,1,7,7,7,7,2,7,7,7,3,2,7,1,6,7,7,7,7,7,7,7,7,7,7,7,6,6,6,7,7,6,6,6,7,6,6,6,6,6,6,6,6,6,2,1,2,3,2,3,3,4,2,2,2,2,2,2,2,1,2,7,7,7,4,4,5,5,4,6,5,4,5,4,5,5,5,5,5,7,7,7,6,7,6,6,6,7,6,6,5,6,6,5,4,4,"Sitarah is able to communicate effectively.
Sitarah keeps calm in stressful situations (deadline)
Sitarah is solution oriented.
Sitarah is hard worker","Is enhancing her delegation skills.
","Sitarah is active listening, reactive and very emphatic.
she exudes a lot of serenity when working in a group.
always smiling, I don’t think I’ve ever seen her upset :)"
