Sitarah,Sherazee,36 months ,3,1,6,4,1,4,6,1,1,6,6,6,4,4,6,6,6,,1,6,1,6,6,6,6,,6,,,6,6,6,6,6,,6,4,4,6,4,7,4,6,6,6,6,6,4,6,6,6,5,5,5,5,5,,,,,,,,,,,,,,,,,,,,,7,7,,6,,6,6,6,6,,6,6,6,6,,,6,6,6,,6,6,,6,6,6,,"Sitarah is always available for assistance and help, she is always ready to find a solution, to dig in more to check with different stakeholders in order to present the correct answer, the correct ways of working. ",,
Sitarah,Sherazee,20,5,2,5,6,5,5,6,2,1,5,,6,,,5,7,6,2,1,6,4,5,5,7,5,6,7,,,,,,,7,7,6,7,7,5,7,6,7,7,6,6,7,6,7,7,6,5,3,2,2,2,3,2,2,4,4,2,2,3,4,3,3,2,2,6,7,7,3,4,,6,,6,7,6,5,7,6,5,5,5,4,7,7,7,6,6,5,7,5,5,4,5,5,7,6,5,5,4,She is always really calm in her working style. I think this is really helpful in stressful situations. She is also easy to work with and find a common language. ,I think she is great in collaborating with others and being really diplomatic. She also shows her opinion clearly but I think she could improve in having a firm standpoint and guiding others towards a goal with her leadership skills.,
Sitarah,Sherazee,5,5,1,,,6,5,,1,3,7,6,6,2,1,6,6,6,1,,7,1,6,6,6,,,,,,,,,,,,,6,6,4,6,7,4,6,6,6,6,6,6,6,4,6,1,5,2,2,2,1,2,5,3,1,1,1,1,1,1,1,1,,,,,,,,,7,7,,6,6,6,6,6,6,4,6,6,6,6,6,4,7,7,4,4,4,6,6,7,4,4,4,Sitarah is very good at listening to others and supporting ,Slowing down and checking for understanding in others when she is explaining ideas or situations,It's great working with Sitarah and I really value her partnership
Sitarah,Sherazee,9 years ,4,1,7,5,4,6,6,4,1,4,6,7,5,4,7,7,7,7,7,6,1,6,5,6,7,7,7,5,7,7,7,7,7,7,7,7,7,7,7,7,7,7,7,7,7,7,7,7,7,7,7,3,3,5,5,5,5,5,5,5,2,4,5,4,2,2,2,2,7,7,7,4,4,4,2,6,4,7,7,6,4,4,5,7,4,5,5,7,3,6,3,6,6,3,4,3,4,7,6,3,7,7,7,,,
Sitarah,Sherazee,17,6,1,7,7,2,2,7,1,1,7,7,7,2,3,7,7,7,2,2,7,1,7,7,7,7,2,7,7,7,7,7,7,7,7,7,7,7,7,7,7,7,7,7,7,7,7,7,7,7,7,7,5,5,5,5,5,5,5,5,5,5,5,5,5,4,4,4,4,6,6,6,7,6,6,6,6,7,7,7,7,7,7,7,7,7,7,7,7,7,7,7,7,7,7,7,7,7,7,7,7,7,7,7,She ensures that the other person feels comfortable to facilitate more effective conversations.,I dont have anything to highlight for now. ,Its been a pleasure working with her and the team MSD. 
Sitarah,Sherazee,96 months,3,1,5,6,,,7,1,1,7,7,7,1,1,7,6,7,1,2,7,2,6,6,7,7,6,7,6,6,7,,6,6,7,7,7,7,7,6,6,7,6,7,6,6,7,7,6,6,6,7,3,4,4,5,5,5,3,4,5,2,4,4,4,2,2,1,1,7,7,7,4,4,5,6,6,7,7,6,4,6,7,6,5,4,6,7,7,7,7,5,6,7,7,7,4,4,6,5,5,7,4,6,Sitarah works well with others by demonstrating strong and effective communication & collaboration skills. She also actively listens to others perspectives and opinions to deliver a positive team dynamic. She always has an ability to understand the different viewpoint to ensure a common ground is build for agreement while also giving constructive feedback when needed. ,To learn different and effective conflict resolution strategies which will help others to adapt different working styles and personalities. ,"As Sitarah continues to develop and improve her interpersonal skills, always remember to embrace the challenges as opportunities for growth. Her dedication and efforts are commendable."
Sitarah,Sherazee,I have been working with Sitarah for many years,3,1,6,6,,,6,2,1,7,7,7,,2,6,6,6,,2,7,2,6,6,6,7,,6,,,7,,7,6,6,6,6,6,6,6,7,6,6,7,7,7,4,7,7,6,6,4,5,5,5,5,5,5,5,5,5,5,5,5,5,5,5,5,5,7,7,7,,,,,,,7,,6,6,7,7,7,7,6,6,7,7,7,6,7,7,6,6,6,6,6,6,6,6,6,4,She is very professional and has a great experience in our group,,
Sitarah,Sherazee,Approximately 120 months (10 years),3,1,7,6,4,6,7,2,2,6,7,6,2,2,7,7,7,2,1,7,1,4,7,6,7,4,7,6,6,7,7,7,7,7,7,7,7,6,6,7,6,7,7,7,7,7,6,6,6,6,6,4,5,5,5,5,5,4,4,4,5,5,5,4,4,4,4,4,7,7,7,6,6,6,7,7,7,7,7,6,7,7,7,7,7,6,7,7,7,7,6,6,7,6,6,6,7,7,6,7,6,6,4,"Through my experience working in a team which Sitarah has been leading, she has excelled in promoting team work by delegating assignments with confidence and closely following up on progress to achieve set objectives.",Enhancing knowledge of cross-functional roles and responsibilities,
Sitarah,Sherazee,9 years ,4,1,5,5,6,6,6,6,3,4,6,6,2,4,7,7,7,7,5,6,2,5,4,6,7,7,7,7,7,7,5,7,7,7,7,7,6,6,6,6,7,6,7,7,7,7,6,7,7,6,7,4,5,5,4,4,3,3,3,3,3,3,3,4,3,3,4,4,7,7,7,4,4,4,4,4,7,7,7,6,5,5,4,6,4,3,4,5,5,6,5,5,6,4,3,5,6,7,6,6,3,7,7,,,
Sitarah,Sherazee,96+ Months (More than 8 Years),3,4,6,6,6,6,6,2,2,6,2,6,5,6,6,6,6,2,2,6,6,4,6,5,5,6,6,6,5,6,6,6,6,6,6,6,5,4,6,5,6,2,6,6,6,6,6,6,6,6,6,3,4,4,4,4,4,4,4,4,4,4,4,4,4,4,4,4,6,6,6,6,5,6,6,6,5,6,6,6,6,6,5,5,5,5,5,6,6,5,6,6,6,6,5,4,6,6,6,5,5,6,5,Very Focused and Dedicated to her objectives,To expand the length and breath of the knowledge base,
Ankit,Sinha,48,1,7,7,7,6,6,7,2,2,7,6,7,2,1,7,6,7,1,2,7,2,7,7,7,6,6,7,6,5,6,6,7,6,7,7,6,7,7,7,7,7,7,7,7,7,6,6,6,7,7,7,5,4,4,4,4,4,4,4,5,5,4,4,4,4,4,4,4,7,7,6,6,6,7,7,7,7,7,6,7,6,6,7,7,7,7,7,7,6,6,7,6,7,7,6,7,6,7,7,7,7,7,7,Ankit is a highly effective communicator who consistently over-delivers for his stakeholders. ,Ankit can continue to grow his team leadership skills with time and experience. ,Ankit ability to consistently drive effective results for the Business is a benefit to the Company
Ankit,Sinha,3 years,1,1,7,6,6,6,7,2,1,6,6,6,2,1,6,6,6,1,2,6,,6,6,6,4,6,6,,4,6,6,6,6,6,,6,6,7,6,6,6,6,6,6,6,7,6,6,6,6,6,4,5,2,4,3,2,2,5,2,2,2,5,4,2,2,2,2,6,6,7,5,6,4,5,5,7,7,4,6,6,6,6,6,6,5,7,6,6,6,6,6,6,6,6,5,6,6,6,6,6,6,6,Ankit has great follow-up skills and ensures those he works with are clear on what is expected and timing of the project completion.,"I want Ankit to feel comfortable to challenge the leadership in the right way.  He is so knowledgeable and has some really good ideas.  I want him to feel comfortable to stand on his own and not need leaderships blessing before moving forward.

",He has made a significant impact in his current role in a short period of time.  Keep up the great work
Ankit,Sinha,Approximately 24,5,2,6,6,4,6,6,1,2,5,5,7,2,1,6,6,6,2,4,6,2,6,6,7,7,4,6,6,4,6,6,6,6,7,7,7,6,6,6,6,6,6,6,6,6,6,6,4,4,6,6,4,5,4,4,4,3,4,4,4,4,3,3,3,3,4,3,3,6,6,6,,,,,,6,6,6,6,5,6,5,5,,6,7,7,7,6,6,5,7,5,5,5,6,6,7,6,6,5,6,Ankit is very collaborative and open.,Ankit could be a bit more responsive and therefore deal with things while they are fresh and more easily resolved.  ,Thank you Ankit for a productive and healthy relationship.
Ankit,Sinha,6,3,2,6,7,6,5,5,2,4,5,5,7,4,2,5,7,7,7,5,6,4,6,6,6,7,7,7,,7,,,,,7,7,7,7,7,6,4,7,7,7,7,7,7,6,6,6,4,5,4,4,4,4,4,4,4,4,4,4,3,4,4,4,4,4,4,7,7,7,5,4,,,,7,7,6,6,7,7,6,7,6,6,6,6,7,5,6,5,6,6,6,6,6,6,6,6,6,6,6,Inclusive in the solutioning approach and gives credit where credit is due.,He can be more timely in interactions with his teammates.  This could be due to Ankit being very busy with many responsibilities.,Ankit has a great potential to be leader at Merck.
Ankit,Sinha,12 plus,5,2,6,4,6,5,6,2,2,4,4,6,2,2,6,6,6,4,4,6,6,6,6,6,6,4,6,,,,,6,6,6,6,6,6,4,4,6,6,4,6,4,6,4,4,4,5,4,5,2,2,3,3,3,2,3,4,3,3,3,3,3,1,1,1,1,,,,5,5,5,5,5,,7,,6,6,6,6,6,5,6,6,6,6,6,6,6,6,6,6,6,6,6,6,6,6,6,4,Looks to include varying partners in functional areas across the company rather than the same big 4.,,
Ankit,Sinha,24,3,2,6,6,6,6,6,2,2,6,4,6,3,2,6,6,6,2,2,6,2,6,6,6,6,6,6,5,6,6,6,6,6,6,6,6,6,6,6,6,6,6,6,6,6,6,6,6,6,6,6,4,4,4,4,4,4,4,4,3,3,3,3,3,3,3,3,3,6,6,6,,,4,,,6,7,,6,6,6,6,6,6,6,6,6,6,6,6,6,6,6,5,6,6,6,7,6,6,6,6,Shows empathy and genuine interest for people's well-being.,,
Ankit,Sinha,24,3,2,6,6,6,6,6,1,2,6,4,6,2,1,6,6,6,2,5,6,2,6,6,6,4,6,6,4,,6,,,,,,,6,6,6,,7,6,7,6,6,6,6,7,4,7,6,3,3,3,4,3,2,3,3,4,2,2,3,2,2,2,2,2,5,5,6,4,3,,6,5,6,7,,6,6,6,6,7,6,4,5,6,6,6,6,5,7,6,6,6,6,7,6,6,6,6,6,Ankit is very open to new ideas and continuously improving.,Ankit can be more assertive in ensuring his ideas are heard and implemented,N/A
Ankit,Sinha,36 +,2,1,6,6,7,6,5,2,2,6,7,6,2,4,6,6,7,5,5,6,3,6,6,7,5,4,5,4,6,6,7,,6,,5,7,7,7,6,6,6,6,6,,6,5,5,5,6,5,7,4,4,4,5,5,5,4,4,4,4,4,4,4,4,4,4,4,6,7,7,6,6,6,6,7,7,7,7,6,6,6,6,6,6,6,6,7,7,6,7,6,7,7,6,6,6,6,6,6,6,6,6,He is always open to sharing new ideas and WOW that can be more efficient ,"Ankit is phenomenal colleague who i have a lot of respect for both professional and personally.   As he continues to advance his career, he needs to continue and be mindful of reading the audience in the room and from their can always pivot in how he delivers messaging. 
 ",He is a wonderful colleague.  Sky is the limit for his career advancement. 
Ankit,Sinha,24,6,2,6,6,7,6,7,2,5,5,5,6,2,3,6,5,6,,,6,,6,6,6,6,6,6,,,6,6,6,6,6,6,6,6,6,6,7,6,6,6,6,6,6,6,6,6,6,6,3,3,3,3,3,3,2,2,2,2,2,2,2,1,1,1,1,5,5,5,4,4,4,4,4,5,5,5,4,4,4,4,4,4,5,7,6,6,6,6,6,7,4,4,4,6,6,6,6,6,6,6,"Ankit demonstrates exceptional skill in actively listening to our thoughts and incorporating them into the development of solutions. This ability not only showcases his attentiveness but also his commitment to understanding the perspectives and needs of those involved. By valuing and integrating diverse viewpoints, Ankit fosters collaboration and ensures that the solutions generated are well-rounded and effective. His approach exemplifies strong communication skills and a genuine dedication to achieving the best outcomes for all stakeholders.","While Ankit excels in listening and considering various perspectives when developing solutions, there's an opportunity for improvement in the personalization of responses and the avoidance of blanket solutions. It's important for Ankit to recognize that different suppliers have unique relationships and histories with the organization. By being more personal in responses, Ankit can strengthen these relationships and tailor solutions to better meet the specific needs of each supplier. Additionally, when utilizing blanket solutions, clear communication is key. Ankit should ensure that suppliers understand how these solutions apply to their individual circumstances and provide any necessary clarification or customization as needed. By incorporating these adjustments, Ankit can further enhance collaboration and foster stronger partnerships with suppliers.",
Ankit,Sinha,12,4,1,7,6,7,6,7,2,2,6,6,6,2,1,7,7,7,7,1,6,1,6,6,7,7,7,7,6,6,7,7,6,7,6,6,7,6,6,6,6,6,6,7,6,6,6,6,6,6,5,6,2,2,4,2,2,2,2,4,4,4,4,4,4,4,4,4,4,6,7,7,6,7,7,7,7,7,7,7,7,7,7,7,7,7,6,6,7,7,7,7,6,6,7,7,7,7,7,7,7,7,6,6,He is able establish good relationship with colleagues and suppliers,,
Ankit,Sinha,11,4,1,7,7,7,7,5,1,2,5,6,7,1,2,6,6,6,1,1,5,1,4,6,6,6,6,6,5,5,7,7,7,7,7,7,7,6,6,6,6,6,6,6,6,6,4,5,5,7,7,7,3,4,4,4,4,1,2,2,2,1,2,2,4,1,2,2,2,6,6,6,5,3,6,5,6,5,7,7,4,2,2,2,4,2,6,6,6,6,6,6,6,6,6,7,6,6,6,6,6,6,6,6,"Communication - He is able to understand quickly, and choose the right impactful words",Learn to push back and refuse non-added value tasks,"Ankit, I am excited to see your leadership skills grow because I see a lot of potential in you as a leader."
Ankit,Sinha,18,3,1,7,7,7,7,7,1,1,7,7,7,,,7,7,7,1,1,7,1,7,7,7,7,7,7,7,7,7,7,7,7,7,7,7,6,6,6,6,6,6,6,6,6,6,6,6,6,6,6,5,5,5,5,5,5,5,5,5,5,5,5,5,5,5,5,5,7,7,7,7,7,7,7,7,7,7,7,7,7,7,7,7,7,6,6,6,6,6,6,6,6,6,6,6,6,6,6,6,6,6,6,"Ankit is an amazing collaborator.  He is extremely responsive, and always seeks to understand the business need.  He is friendly, committed, passionate about his work, and just a pleasure to work with.  ",Something he is already doing naturally - seeking to understand the business drivers and develop his strategic business knowledge.,I am so lucky to work with Ankit in ESG! 
Ankit,Sinha,48,2,1,6,6,6,7,7,1,1,7,6,6,2,1,7,7,7,1,2,7,2,7,7,7,6,5,6,4,6,6,4,6,6,6,6,6,6,7,6,7,7,7,7,7,7,7,6,6,6,4,5,4,5,4,4,4,4,4,4,4,2,2,2,2,2,2,1,1,7,7,7,5,6,7,7,7,7,7,7,6,6,6,6,6,6,7,7,7,7,7,7,7,7,7,7,7,7,7,7,5,6,7,6,He is humble; he gets to know others personally which enables better connections and effectiveness,"He should say ""no"" and/or delegate when a request is too much and he does not have capacity",
Ankit,Sinha,12,2,2,6,6,6,6,6,2,2,6,6,6,2,2,6,6,6,3,3,6,2,6,6,6,6,6,6,6,6,6,6,6,6,6,6,6,6,6,6,6,6,6,6,6,6,6,6,6,7,6,6,5,5,5,5,5,5,5,5,5,4,4,4,4,4,4,4,4,7,7,7,7,7,7,7,7,7,7,7,6,6,6,6,6,6,5,6,6,6,6,6,6,6,6,5,5,6,6,6,6,6,6,6,Ankit is collaborative and has the ability to build strong relationships through building trust and credibility with others.,An opportunity for Ankit is to ask for and give constructive feedback.,He has the right attitude and approach to problem-solving. He evaluates opportunities holistically and applies an enterprise mindset to achieve an optimal outcome for the organization.
Kaitlin,Tornetta,22,5,2,5,,5,4,5,2,2,4,6,5,2,1,5,5,4,2,1,6,2,6,6,6,7,6,7,,,7,6,7,,7,6,7,5,6,4,5,5,6,7,5,6,5,5,4,3,5,3,4,5,2,2,2,2,4,2,3,2,2,2,2,2,2,1,2,5,2,5,3,2,3,,,6,7,6,5,5,6,5,4,4,5,7,6,6,4,6,4,6,5,6,5,6,6,5,6,7,5,5,"Kate is good at making conversations feel like an open forum of ideas. You don't feel attacked for presenting new ideas, even if she might personally disagree with them. I always feel like she helps make conversations inclusive and she is very good at crediting others for their hard work.","When outlining what needs to be accomplish for a task or group objective, I think Kate can improve on providing more details to help convince the group that this is the best course of action, so that everyone is equally on board with the idea. For example, there has been a few situations where and end goal is communicated (we need to do X, or accomplish X), but the rationale behind it or reason why it needs to be accomplished in that way hasn't been very clear.",Asking and truly digesting feedback is a great step to becoming a better leader! Thank you for including me in the feedback you are sourcing. 
Kaitlin,Tornetta,7,4,2,6,6,6,6,6,2,2,5,6,6,2,2,6,6,6,2,3,6,2,6,6,6,7,6,6,6,6,7,6,6,6,7,6,7,6,6,6,6,6,6,6,6,6,6,6,6,6,6,6,4,4,4,4,3,4,4,4,4,4,4,4,4,3,4,3,3,6,6,6,4,4,5,6,,7,6,4,6,6,6,6,6,4,4,6,6,6,6,6,5,6,6,5,4,6,6,6,6,6,5,5,,,
Kaitlin,Tornetta,36+,3,1,6,7,7,7,7,1,2,6,7,7,1,1,7,7,7,1,3,6,1,7,7,7,7,7,7,5,6,7,7,7,7,7,6,7,7,7,7,7,7,7,7,7,7,7,6,7,7,7,7,4,5,4,4,4,4,4,5,4,2,2,3,5,3,4,5,5,6,6,7,6,6,5,4,7,7,7,6,7,6,5,7,7,6,5,7,7,7,7,6,6,7,6,6,6,7,7,7,7,6,6,6,"Kate takes the time to establish the background of the work, both what and why it is important. In working through partner tiering, operations and external leads needed to understand what was historically done. This was valuable when we needed to update the tiering segmentation of suppliers to drive more strategic efforts where there were gaps previously.","Kate provides constructive feedback and guidance to team members, but sometimes ends up stepping in when activities are not delivered by team members. Sometimes these team members would benefit by being held accountable for their deliverables rather than leaning more heavily on Kate. However, I do feel that she models the behaviors and activities that are required to get the job done. So perhaps personnel are learning by seeing her activities. Occasionally Kate can absorb ideas from various leads to synthesize an approach and pressure test it, but it may not be recognized as coming from the team. It is a minor comment that she make sure to recognize these group-synthesized views. ",Our brainstorming discussions and pre-planning of activities has really been valuable to sync up our teams on projects and deliverables. She is an amazing and talented collaborative partner. 
Kaitlin,Tornetta,96,2,4,6,6,6,5,7,2,2,4,5,7,4,2,6,4,7,2,2,7,4,6,6,6,4,5,6,6,6,7,6,6,6,6,7,7,6,7,5,7,7,7,7,6,6,6,6,6,6,5,6,2,4,2,2,2,2,2,3,2,2,2,2,3,2,2,2,3,7,6,6,4,4,4,5,4,6,6,6,4,4,4,4,6,4,5,6,6,6,6,6,5,7,5,5,5,5,6,5,6,5,5,4,,,
Kaitlin,Tornetta,10,6,2,4,4,6,,7,2,2,4,5,5,3,4,7,6,6,5,2,7,7,6,6,6,6,6,6,4,6,6,6,6,6,6,6,6,4,5,4,6,6,6,6,6,6,4,6,4,6,6,4,4,4,4,4,4,4,4,4,4,4,4,4,4,4,4,4,4,6,5,5,5,5,,,,5,5,5,,5,,5,,,4,6,6,6,5,6,6,6,4,4,5,5,6,6,4,6,6,4,Kaitlin has a way of speaking openly in a reasonably fact-based manner without being emotional.,"Kaitlin could work on transmitting her communication style among some of her team members who do not possess her skills at verbal communication. 
",
Kaitlin,Tornetta,24,5,1,6,7,7,6,7,5,2,6,5,5,2,5,6,6,6,6,2,7,2,6,6,6,6,6,6,,,,,5,6,,,6,6,5,5,5,7,6,6,6,6,7,,6,6,6,6,2,3,3,2,1,2,2,2,2,1,1,3,1,2,2,2,2,5,5,5,5,6,6,6,5,4,6,5,6,6,6,6,6,6,5,6,6,6,6,6,5,7,7,6,6,6,6,6,6,7,7,7,Kate is extremely warm while at the same time professional which creates an atmosphere for very productive discussions.  We have negotiated tricky situations in the past and she is always willing to listen and understand the other side instead of just reacting.  She also is very good at bringing in the right and relevant external teams when needed.,"She is extremely personable, but her emails sometimes come across a little harsher than she intends. That's somewhat of a Merck Procurement style we have observed which can sometimes make discussions off putting. ","She brings her authentic self to work and she is always a pleasure to work with even in somewhat complicated situations.  I have seen her be able to juggle personal struggles while maintaining an extremely professional attitude and demeanor which not many people can muster.  Her warm personality and ability to truly listen and ask questions, as well as bringing in the key stakeholders at the right time are some of her strengths. Stronger oversight of her team, their approach and behavior especially on their engagement, approach and communication externally is necessary as they don't all show her strong exemplary professional behavior which I am sure she expects from them."
Kaitlin,Tornetta,48,2,1,6,6,4,6,7,2,2,4,6,6,1,2,7,6,7,1,1,6,4,6,6,7,7,6,6,6,7,6,6,6,6,6,6,6,6,6,6,6,7,7,6,6,6,6,6,6,6,4,6,5,5,5,5,5,5,5,5,5,5,5,5,4,4,4,4,4,7,7,7,,,,,,7,7,7,7,7,7,7,7,7,5,7,7,7,7,7,5,6,6,5,5,6,6,6,7,6,5,5,She does not appear to have hidden agendas so you can trust what she is saying. She seems to always want to do the right thing for Merck and Merck's priorities.,,
Kaitlin,Tornetta,120,4,3,6,4,6,5,5,3,1,4,6,5,2,5,7,5,7,2,5,7,4,5,7,6,5,5,5,4,6,7,5,5,5,5,5,6,6,5,5,4,6,4,6,6,6,6,6,5,7,6,7,5,5,4,4,3,3,4,4,2,2,2,2,2,2,2,2,2,7,7,7,5,3,4,7,6,6,7,6,5,5,5,5,5,5,2,5,6,5,5,6,5,5,5,4,3,4,5,5,5,5,5,4,Kaitlin is very organized and a great communicator. She has the ability to influence stakeholders to achieve the company objectives. She does a great job of solving complex problems and resolving issues in a timely fashion. Her work ethic is very strong which as a leader is contagious to her team. ,At times she gets too involved in details of a project where she can delegate the work to her team. This would free her up for more strategy type work and give her teammates the opportunity to own more of their work. ,"Overall, I think she has done a great job leading the team!"
Kaitlin,Tornetta,24,3,1,6,7,6,6,6,1,2,6,6,6,2,2,6,6,7,2,2,6,2,6,6,6,6,6,6,6,6,6,6,6,6,6,6,6,6,6,6,6,6,6,6,6,6,6,6,6,6,6,6,4,5,4,4,4,4,4,5,4,4,4,4,4,4,4,3,4,6,7,7,5,3,6,6,6,6,7,6,6,6,6,7,6,6,5,7,6,7,6,6,5,7,6,6,5,7,6,6,6,6,6,6,Flexibility - listens to need and finds a way to enable without creating a wave of problems behind her,Make sure to also put your ideas and needs forward,I am so happy to work with you and that you are part of our larger team
Kaitlin,Tornetta,36,3,2,6,5,6,6,5,4,2,6,6,6,6,2,6,6,6,1,2,7,5,,6,6,5,5,6,,,6,6,6,6,6,6,5,2,6,3,6,6,6,6,6,7,7,6,5,5,7,5,5,5,5,5,5,3,4,4,4,3,3,3,3,3,3,3,3,7,7,7,5,4,5,5,6,6,6,4,4,4,4,4,4,4,4,5,6,6,5,4,6,5,5,5,5,5,4,4,5,5,6,4,She gives background information about the meeting taking place. She's straight forward with her discussion which helps keep attendees focused. ,"I can't immediately think of something right now, but I'm sure she can identify areas where she would like to grow and improve herself. ","I really enjoy working with Kate, she's direct, and I really like that. She's on time with meetings, and follows up with every action item which I appreciate. "
Kaitlin,Tornetta,30,1,1,6,6,6,7,7,1,2,6,6,6,2,1,7,6,7,1,5,6,2,7,7,7,6,6,6,6,7,7,6,6,6,7,6,6,6,7,6,6,7,6,6,6,6,6,6,6,6,6,6,4,5,4,4,4,4,4,4,4,5,5,5,4,4,4,4,4,7,7,6,6,6,6,7,7,7,6,6,7,6,6,6,6,6,5,7,7,7,6,6,6,7,7,5,5,7,7,7,5,5,5,6,"She is very genuine and transparent.  She communicates clearly and takes the time to listen to others.
Colleagues feel heard and understood when working with Kate.  She has good instincts
","Holding her ground and leveraging her 'power' in discussions.  She is well respected and viewed as a true leader in the organization.  Her niceness can sometimes be viewed as weakness, but Kate is strong and can hold her ground without damaging relationships, but she has more clout than she knows with her stakeholders :) ",She is developing into a very effective manager with a bright future ahead.  She manages her individual team members as individuals and takes different approaches as needed.  She cares a lot and it shows.  She is a keeper !
Kaitlin,Tornetta,54,2,,,,,,,,,,,,,,,,,,,,,,,,,,,,,,,,,,,,,,,,,,,,,,,,,,,4,4,4,4,5,4,4,5,4,5,5,5,4,4,4,4,4,6,6,6,6,6,5,5,6,7,6,4,5,5,6,5,6,5,5,7,7,7,6,6,4,7,6,6,6,7,7,7,5,5,5,6,Connects,Kate needs to grow her confidence to believe what we all see is true. She is a natural leader and is highly regarded.,
Kaitlin,Tornetta,40,3,2,6,6,7,6,6,1,1,6,6,6,2,1,6,5,7,2,4,7,2,7,7,7,6,6,6,,4,6,7,7,6,7,7,6,1,6,6,6,6,6,6,6,6,5,5,6,6,6,6,4,5,3,3,4,4,4,4,5,3,2,3,2,2,3,3,3,7,7,7,4,4,4,6,5,5,6,,6,5,,6,6,4,5,6,7,6,6,5,6,7,5,5,4,6,6,6,5,7,5,4,She is fully engaged in meetings and listens to all perspectives to reach informed decisions. She's also very good at negotiating and has a good rapport with others.,Kate can leverage others more rather than taking on so much of the work herself.,
Weize,Wee,18,2,2,6,6,6,6,6,2,4,3,4,6,4,4,5,6,6,2,2,6,3,6,6,6,6,6,6,,,6,6,6,6,6,6,6,6,6,6,6,6,6,6,6,6,6,6,6,6,6,6,4,2,2,4,4,2,2,2,4,4,2,2,4,4,4,4,4,6,7,6,3,6,7,7,7,7,7,7,5,5,7,5,7,5,6,6,5,6,6,6,6,6,6,5,6,6,6,6,6,5,4,4,Wei Ze is really hard working and goes above and beyond to drive complex projects to completion - one example is the Third Party Strategy Implementation. ,"One opportunity for Wei Ze would be to improve leadership skills, specifically around presentation of information and sharing details with upper management.",
Weize,Wee,12,2,2,6,4,5,5,5,3,4,4,3,6,2,2,4,4,4,4,2,4,3,2,4,4,5,4,5,4,5,4,4,4,5,4,5,4,4,4,4,4,4,4,5,4,4,4,4,4,5,4,5,4,3,4,3,3,3,3,3,4,3,3,3,3,3,3,3,3,3,4,5,4,4,4,3,2,5,5,4,5,4,4,4,4,4,4,3,5,5,5,5,4,4,5,4,4,4,4,4,4,4,4,5,Wei Ze manages people expectations well and good at presentation. ,,
Weize,Wee,30,3,1,7,4,6,6,6,4,2,6,7,6,1,3,7,4,7,2,4,7,3,7,7,7,6,5,5,,5,6,6,6,6,7,7,7,7,6,6,7,7,6,7,6,6,7,6,5,4,5,7,4,5,4,4,4,3,4,5,4,4,5,5,4,4,5,4,5,7,7,7,7,6,6,6,,7,6,,7,6,6,6,7,5,7,7,7,7,7,7,6,7,7,6,7,5,7,7,7,7,7,6,Wei Ze is a good communicator who understands the problem statement quickly and directs to the right person for resolution. There was one i need help in terms of procurement support and he managed to understand and direct me to the right team member for assistance.,Wei Ze can sometimes come across as being too opinionated.,NA
Weize,Wee,12,4,2,6,4,2,6,6,6,1,5,1,2,2,6,7,3,6,1,2,2,3,7,1,3,6,5,2,6,5,2,5,6,7,2,5,2,3,3,2,2,5,1,2,5,6,2,2,2,3,3,3,2,1,2,2,3,2,3,2,2,2,1,1,1,4,2,2,1,2,6,7,3,5,1,5,3,4,7,,5,5,7,2,2,2,2,2,5,5,6,5,6,6,2,6,5,5,3,2,3,,2,3,Wei Ze is expediting the things when it is urgent.,"He is taking seriously everything. Like if got any stakeholder follow-up email then he takes things as an escalation. However, this is a simple follow-up. Just because of this team member demotivate & their moral is down.",No
Weize,Wee,3,2,1,7,7,7,7,7,1,1,6,6,7,1,1,7,7,7,1,1,7,1,7,7,7,7,7,7,7,7,7,,7,6,7,7,7,7,7,7,4,7,7,7,7,7,7,7,7,7,7,7,5,5,5,5,5,5,5,5,5,5,5,5,5,5,5,4,4,7,7,7,6,6,7,7,7,7,7,7,7,7,7,7,7,7,6,7,7,7,6,7,6,7,7,6,6,7,6,7,7,7,7,6,"Very thoughtful and considerate of others, and always suggesting new ways to make everyone's work easier, more efficient and effective. Recently just gave advice to a teammate on possible ways to resolve a difficult issue, which helped to take stress off her and allowed the issue to be resolved cleanly.",NIL,NIL
Weize,Wee,18,6,5,6,2,6,6,6,6,2,5,3,5,2,5,6,5,6,4,2,6,2,6,4,5,6,5,6,6,4,4,6,6,6,5,6,6,5,4,4,4,6,6,4,6,6,5,4,5,6,5,3,4,5,4,3,4,4,4,3,3,4,4,4,4,4,4,4,4,4,5,7,6,2,4,,,2,6,4,6,6,6,6,6,6,6,4,6,5,5,5,4,6,6,6,6,5,6,5,6,6,4,6,"He is detail oriented and able to analyze info fast and come with fair conclusions. That certainly give him an advantage during discussion to strongly put forward his view. 
","He needs to appreciate people frequently for their efforts which really increases their motivation and confidence.
","Wei Ze is a good leader and is very focused towards making a positive difference to processes, however at the same time needs to be more people centric, providing feedback to team in a balanced way so that the team is motivated to bring a positive difference in the ways of working and not otherwise.."
Weize,Wee,3,2,2,6,4,7,6,6,3,2,5,5,6,2,4,7,6,6,6,2,6,4,6,6,6,6,5,7,6,6,6,5,5,6,6,5,6,5,5,6,6,6,6,6,6,5,5,5,5,5,5,5,4,4,3,3,2,2,3,3,3,2,2,2,2,2,2,3,3,5,6,7,5,4,4,4,4,6,7,4,5,4,5,4,6,6,7,7,6,7,6,6,6,7,7,7,6,6,6,6,6,5,6,5,Effective in communication and able to highlight key points and objectives.,Share more of the background stories and history behind the topic or goal. This will give a better complete picture of the problem or objective.,Keep up the good work.
Weize,Wee,33 months,2,4,5,4,7,5,5,6,3,5,4,6,3,4,5,5,6,5,2,1,2,5,5,5,5,6,7,4,3,5,4,5,5,5,6,4,5,5,2,5,6,4,4,5,4,5,5,5,5,5,2,4,3,3,4,4,1,4,3,4,3,3,3,3,3,3,1,1,6,6,6,4,2,2,3,2,3,5,4,5,2,2,2,2,2,2,5,6,6,5,4,2,6,2,2,2,3,3,5,2,5,4,5,,,
Weize,Wee,15,2,2,6,6,6,6,7,3,2,6,6,7,6,3,7,6,6,2,2,7,6,7,6,6,6,6,6,7,6,6,7,7,7,6,6,6,6,6,6,6,6,6,6,6,6,6,6,6,7,6,5,4,5,4,4,3,3,4,4,3,4,4,5,4,4,4,3,3,5,5,6,6,6,6,7,6,6,7,6,6,6,7,7,6,6,5,6,6,6,6,5,5,6,5,5,5,5,5,6,6,5,5,5,,,
Weize,Wee,13,2,3,5,5,5,5,5,5,5,5,5,5,5,5,5,5,5,5,3,5,5,5,5,5,5,5,5,5,5,5,5,5,5,5,5,5,5,5,5,6,5,5,5,5,5,5,5,5,5,5,5,2,3,3,3,3,2,3,3,3,3,3,3,3,3,3,3,3,5,5,5,5,5,5,5,5,5,5,5,5,5,5,5,5,6,5,5,5,5,5,5,5,5,5,5,6,5,5,5,5,5,5,5,Listens well to others opinion and give valuable feedback,NA,NA
Weize,Wee,3 months,4,2,5,3,5,2,6,4,5,6,6,5,5,3,6,5,5,5,2,7,3,7,6,6,5,5,5,5,5,5,6,6,6,5,5,5,5,5,5,5,5,6,5,5,5,5,5,5,5,5,5,3,3,3,3,3,3,3,3,3,3,3,3,3,3,3,3,3,6,6,6,5,5,6,,,6,6,6,5,5,6,5,5,5,6,5,5,5,5,5,5,6,5,7,6,6,5,6,6,5,5,6,He is confident.  ,Sometimes hypersensitive,NA
